1,11/01/2004,Monday,1,306,Week 44,,44,November,11,2004-11,Q4,2004-Q4,2004,None,2004-11-01 00:00:00
2,11/02/2004,Tuesday,2,307,Week 44,,44,November,11,2004-11,Q4,2004-Q4,2004,None,2004-11-02 00:00:00
3,11/03/2004,Wednesday,3,308,Week 44,,44,November,11,2004-11,Q4,2004-Q4,2004,None,2004-11-03 00:00:00
4,11/04/2004,Thursday,4,309,Week 45,,45,November,11,2004-11,Q4,2004-Q4,2004,None,2004-11-04 00:00:00
5,11/05/2004,Friday,5,310,Week 45,,45,November,11,2004-11,Q4,2004-Q4,2004,None,2004-11-05 00:00:00
6,11/06/2004,Saturday,6,311,Week 45,,45,November,11,2004-11,Q4,2004-Q4,2004,None,2004-11-06 00:00:00
7,11/07/2004,Sunday,7,312,Week 45,,45,November,11,2004-11,Q4,2004-Q4,2004,None,2004-11-07 00:00:00
8,11/08/2004,Monday,8,313,Week 45,,45,November,11,2004-11,Q4,2004-Q4,2004,None,2004-11-08 00:00:00
9,11/09/2004,Tuesday,9,314,Week 45,,45,November,11,2004-11,Q4,2004-Q4,2004,None,2004-11-09 00:00:00
10,11/10/2004,Wednesday,10,315,Week 45,,45,November,11,2004-11,Q4,2004-Q4,2004,None,2004-11-10 00:00:00
11,11/11/2004,Thursday,11,316,Week 46,,46,November,11,2004-11,Q4,2004-Q4,2004,None,2004-11-11 00:00:00
12,11/12/2004,Friday,12,317,Week 46,,46,November,11,2004-11,Q4,2004-Q4,2004,None,2004-11-12 00:00:00
13,11/13/2004,Saturday,13,318,Week 46,,46,November,11,2004-11,Q4,2004-Q4,2004,None,2004-11-13 00:00:00
14,11/14/2004,Sunday,14,319,Week 46,,46,November,11,2004-11,Q4,2004-Q4,2004,None,2004-11-14 00:00:00
15,11/15/2004,Monday,15,320,Week 46,,46,November,11,2004-11,Q4,2004-Q4,2004,None,2004-11-15 00:00:00
16,11/16/2004,Tuesday,16,321,Week 46,,46,November,11,2004-11,Q4,2004-Q4,2004,None,2004-11-16 00:00:00
17,11/17/2004,Wednesday,17,322,Week 46,,46,November,11,2004-11,Q4,2004-Q4,2004,None,2004-11-17 00:00:00
18,11/18/2004,Thursday,18,323,Week 47,,47,November,11,2004-11,Q4,2004-Q4,2004,None,2004-11-18 00:00:00
19,11/19/2004,Friday,19,324,Week 47,,47,November,11,2004-11,Q4,2004-Q4,2004,None,2004-11-19 00:00:00
20,11/20/2004,Saturday,20,325,Week 47,,47,November,11,2004-11,Q4,2004-Q4,2004,None,2004-11-20 00:00:00
21,11/21/2004,Sunday,21,326,Week 47,,47,November,11,2004-11,Q4,2004-Q4,2004,None,2004-11-21 00:00:00
22,11/22/2004,Monday,22,327,Week 47,,47,November,11,2004-11,Q4,2004-Q4,2004,None,2004-11-22 00:00:00
23,11/23/2004,Tuesday,23,328,Week 47,,47,November,11,2004-11,Q4,2004-Q4,2004,None,2004-11-23 00:00:00
24,11/24/2004,Wednesday,24,329,Week 47,,47,November,11,2004-11,Q4,2004-Q4,2004,None,2004-11-24 00:00:00
25,11/25/2004,Thursday,25,330,Week 48,,48,November,11,2004-11,Q4,2004-Q4,2004,None,2004-11-25 00:00:00
26,11/26/2004,Friday,26,331,Week 48,,48,November,11,2004-11,Q4,2004-Q4,2004,None,2004-11-26 00:00:00
27,11/27/2004,Saturday,27,332,Week 48,,48,November,11,2004-11,Q4,2004-Q4,2004,None,2004-11-27 00:00:00
28,11/28/2004,Sunday,28,333,Week 48,,48,November,11,2004-11,Q4,2004-Q4,2004,None,2004-11-28 00:00:00
29,11/29/2004,Monday,29,334,Week 48,,48,November,11,2004-11,Q4,2004-Q4,2004,None,2004-11-29 00:00:00
30,11/30/2004,Tuesday,30,335,Week 48,,48,November,11,2004-11,Q4,2004-Q4,2004,None,2004-11-30 00:00:00
31,12/01/2004,Wednesday,1,336,Week 48,,48,December,12,2004-12,Q4,2004-Q4,2004,None,2004-12-01 00:00:00
32,12/02/2004,Thursday,2,337,Week 49,,49,December,12,2004-12,Q4,2004-Q4,2004,None,2004-12-02 00:00:00
33,12/03/2004,Friday,3,338,Week 49,,49,December,12,2004-12,Q4,2004-Q4,2004,None,2004-12-03 00:00:00
34,12/04/2004,Saturday,4,339,Week 49,,49,December,12,2004-12,Q4,2004-Q4,2004,None,2004-12-04 00:00:00
35,12/05/2004,Sunday,5,340,Week 49,,49,December,12,2004-12,Q4,2004-Q4,2004,None,2004-12-05 00:00:00
36,12/06/2004,Monday,6,341,Week 49,,49,December,12,2004-12,Q4,2004-Q4,2004,None,2004-12-06 00:00:00
37,12/07/2004,Tuesday,7,342,Week 49,,49,December,12,2004-12,Q4,2004-Q4,2004,None,2004-12-07 00:00:00
38,12/08/2004,Wednesday,8,343,Week 49,,49,December,12,2004-12,Q4,2004-Q4,2004,None,2004-12-08 00:00:00
39,12/09/2004,Thursday,9,344,Week 50,,50,December,12,2004-12,Q4,2004-Q4,2004,None,2004-12-09 00:00:00
40,12/10/2004,Friday,10,345,Week 50,,50,December,12,2004-12,Q4,2004-Q4,2004,None,2004-12-10 00:00:00
41,12/11/2004,Saturday,11,346,Week 50,,50,December,12,2004-12,Q4,2004-Q4,2004,None,2004-12-11 00:00:00
42,12/12/2004,Sunday,12,347,Week 50,,50,December,12,2004-12,Q4,2004-Q4,2004,None,2004-12-12 00:00:00
43,12/13/2004,Monday,13,348,Week 50,,50,December,12,2004-12,Q4,2004-Q4,2004,None,2004-12-13 00:00:00
44,12/14/2004,Tuesday,14,349,Week 50,,50,December,12,2004-12,Q4,2004-Q4,2004,None,2004-12-14 00:00:00
45,12/15/2004,Wednesday,15,350,Week 50,,50,December,12,2004-12,Q4,2004-Q4,2004,None,2004-12-15 00:00:00
46,12/16/2004,Thursday,16,351,Week 51,,51,December,12,2004-12,Q4,2004-Q4,2004,None,2004-12-16 00:00:00
47,12/17/2004,Friday,17,352,Week 51,,51,December,12,2004-12,Q4,2004-Q4,2004,None,2004-12-17 00:00:00
48,12/18/2004,Saturday,18,353,Week 51,,51,December,12,2004-12,Q4,2004-Q4,2004,None,2004-12-18 00:00:00
49,12/19/2004,Sunday,19,354,Week 51,,51,December,12,2004-12,Q4,2004-Q4,2004,None,2004-12-19 00:00:00
50,12/20/2004,Monday,20,355,Week 51,,51,December,12,2004-12,Q4,2004-Q4,2004,None,2004-12-20 00:00:00
51,12/21/2004,Tuesday,21,356,Week 51,,51,December,12,2004-12,Q4,2004-Q4,2004,None,2004-12-21 00:00:00
52,12/22/2004,Wednesday,22,357,Week 51,,51,December,12,2004-12,Q4,2004-Q4,2004,None,2004-12-22 00:00:00
53,12/23/2004,Thursday,23,358,Week 52,,52,December,12,2004-12,Q4,2004-Q4,2004,None,2004-12-23 00:00:00
54,12/24/2004,Friday,24,359,Week 52,,52,December,12,2004-12,Q4,2004-Q4,2004,None,2004-12-24 00:00:00
55,12/25/2004,Saturday,25,360,Week 52,,52,December,12,2004-12,Q4,2004-Q4,2004,None,2004-12-25 00:00:00
56,12/26/2004,Sunday,26,361,Week 52,,52,December,12,2004-12,Q4,2004-Q4,2004,None,2004-12-26 00:00:00
57,12/27/2004,Monday,27,362,Week 52,,52,December,12,2004-12,Q4,2004-Q4,2004,None,2004-12-27 00:00:00
58,12/28/2004,Tuesday,28,363,Week 52,,52,December,12,2004-12,Q4,2004-Q4,2004,None,2004-12-28 00:00:00
59,12/29/2004,Wednesday,29,364,Week 52,,52,December,12,2004-12,Q4,2004-Q4,2004,None,2004-12-29 00:00:00
60,12/30/2004,Thursday,30,365,Week 52,,52,December,12,2004-12,Q4,2004-Q4,2004,None,2004-12-30 00:00:00
61,12/31/2004,Friday,31,366,Week 52,,52,December,12,2004-12,Q4,2004-Q4,2004,None,2004-12-31 00:00:00
62,01/01/2005,Saturday,1,1,Week 1,,1,January,1,2005-01,Q1,2005-Q1,2005,None,2005-01-01 00:00:00
63,01/02/2005,Sunday,2,2,Week 1,,1,January,1,2005-01,Q1,2005-Q1,2005,None,2005-01-02 00:00:00
64,01/03/2005,Monday,3,3,Week 1,,1,January,1,2005-01,Q1,2005-Q1,2005,None,2005-01-03 00:00:00
65,01/04/2005,Tuesday,4,4,Week 1,,1,January,1,2005-01,Q1,2005-Q1,2005,None,2005-01-04 00:00:00
66,01/05/2005,Wednesday,5,5,Week 1,,1,January,1,2005-01,Q1,2005-Q1,2005,None,2005-01-05 00:00:00
67,01/06/2005,Thursday,6,6,Week 1,,1,January,1,2005-01,Q1,2005-Q1,2005,None,2005-01-06 00:00:00
68,01/07/2005,Friday,7,7,Week 1,,1,January,1,2005-01,Q1,2005-Q1,2005,None,2005-01-07 00:00:00
69,01/08/2005,Saturday,8,8,Week 2,,2,January,1,2005-01,Q1,2005-Q1,2005,None,2005-01-08 00:00:00
70,01/09/2005,Sunday,9,9,Week 2,,2,January,1,2005-01,Q1,2005-Q1,2005,None,2005-01-09 00:00:00
71,01/10/2005,Monday,10,10,Week 2,,2,January,1,2005-01,Q1,2005-Q1,2005,None,2005-01-10 00:00:00
72,01/11/2005,Tuesday,11,11,Week 2,,2,January,1,2005-01,Q1,2005-Q1,2005,None,2005-01-11 00:00:00
73,01/12/2005,Wednesday,12,12,Week 2,,2,January,1,2005-01,Q1,2005-Q1,2005,None,2005-01-12 00:00:00
74,01/13/2005,Thursday,13,13,Week 2,,2,January,1,2005-01,Q1,2005-Q1,2005,None,2005-01-13 00:00:00
75,01/14/2005,Friday,14,14,Week 2,,2,January,1,2005-01,Q1,2005-Q1,2005,None,2005-01-14 00:00:00
76,01/15/2005,Saturday,15,15,Week 3,,3,January,1,2005-01,Q1,2005-Q1,2005,None,2005-01-15 00:00:00
77,01/16/2005,Sunday,16,16,Week 3,,3,January,1,2005-01,Q1,2005-Q1,2005,None,2005-01-16 00:00:00
78,01/17/2005,Monday,17,17,Week 3,,3,January,1,2005-01,Q1,2005-Q1,2005,None,2005-01-17 00:00:00
79,01/18/2005,Tuesday,18,18,Week 3,,3,January,1,2005-01,Q1,2005-Q1,2005,None,2005-01-18 00:00:00
80,01/19/2005,Wednesday,19,19,Week 3,,3,January,1,2005-01,Q1,2005-Q1,2005,None,2005-01-19 00:00:00
81,01/20/2005,Thursday,20,20,Week 3,,3,January,1,2005-01,Q1,2005-Q1,2005,None,2005-01-20 00:00:00
82,01/21/2005,Friday,21,21,Week 3,,3,January,1,2005-01,Q1,2005-Q1,2005,None,2005-01-21 00:00:00
83,01/22/2005,Saturday,22,22,Week 4,,4,January,1,2005-01,Q1,2005-Q1,2005,None,2005-01-22 00:00:00
84,01/23/2005,Sunday,23,23,Week 4,,4,January,1,2005-01,Q1,2005-Q1,2005,None,2005-01-23 00:00:00
85,01/24/2005,Monday,24,24,Week 4,,4,January,1,2005-01,Q1,2005-Q1,2005,None,2005-01-24 00:00:00
86,01/25/2005,Tuesday,25,25,Week 4,,4,January,1,2005-01,Q1,2005-Q1,2005,None,2005-01-25 00:00:00
87,01/26/2005,Wednesday,26,26,Week 4,,4,January,1,2005-01,Q1,2005-Q1,2005,None,2005-01-26 00:00:00
88,01/27/2005,Thursday,27,27,Week 4,,4,January,1,2005-01,Q1,2005-Q1,2005,None,2005-01-27 00:00:00
89,01/28/2005,Friday,28,28,Week 4,,4,January,1,2005-01,Q1,2005-Q1,2005,None,2005-01-28 00:00:00
90,01/29/2005,Saturday,29,29,Week 5,,5,January,1,2005-01,Q1,2005-Q1,2005,None,2005-01-29 00:00:00
91,01/30/2005,Sunday,30,30,Week 5,,5,January,1,2005-01,Q1,2005-Q1,2005,None,2005-01-30 00:00:00
92,01/31/2005,Monday,31,31,Week 5,,5,January,1,2005-01,Q1,2005-Q1,2005,None,2005-01-31 00:00:00
93,02/01/2005,Tuesday,1,32,Week 5,,5,February,2,2005-02,Q1,2005-Q1,2005,None,2005-02-01 00:00:00
94,02/02/2005,Wednesday,2,33,Week 5,,5,February,2,2005-02,Q1,2005-Q1,2005,None,2005-02-02 00:00:00
95,02/03/2005,Thursday,3,34,Week 5,,5,February,2,2005-02,Q1,2005-Q1,2005,None,2005-02-03 00:00:00
96,02/04/2005,Friday,4,35,Week 5,,5,February,2,2005-02,Q1,2005-Q1,2005,None,2005-02-04 00:00:00
97,02/05/2005,Saturday,5,36,Week 6,,6,February,2,2005-02,Q1,2005-Q1,2005,None,2005-02-05 00:00:00
98,02/06/2005,Sunday,6,37,Week 6,,6,February,2,2005-02,Q1,2005-Q1,2005,None,2005-02-06 00:00:00
99,02/07/2005,Monday,7,38,Week 6,,6,February,2,2005-02,Q1,2005-Q1,2005,None,2005-02-07 00:00:00
100,02/08/2005,Tuesday,8,39,Week 6,,6,February,2,2005-02,Q1,2005-Q1,2005,None,2005-02-08 00:00:00
101,02/09/2005,Wednesday,9,40,Week 6,,6,February,2,2005-02,Q1,2005-Q1,2005,None,2005-02-09 00:00:00
102,02/10/2005,Thursday,10,41,Week 6,,6,February,2,2005-02,Q1,2005-Q1,2005,None,2005-02-10 00:00:00
103,02/11/2005,Friday,11,42,Week 6,,6,February,2,2005-02,Q1,2005-Q1,2005,None,2005-02-11 00:00:00
104,02/12/2005,Saturday,12,43,Week 7,,7,February,2,2005-02,Q1,2005-Q1,2005,None,2005-02-12 00:00:00
105,02/13/2005,Sunday,13,44,Week 7,,7,February,2,2005-02,Q1,2005-Q1,2005,None,2005-02-13 00:00:00
106,02/14/2005,Monday,14,45,Week 7,,7,February,2,2005-02,Q1,2005-Q1,2005,None,2005-02-14 00:00:00
107,02/15/2005,Tuesday,15,46,Week 7,,7,February,2,2005-02,Q1,2005-Q1,2005,None,2005-02-15 00:00:00
108,02/16/2005,Wednesday,16,47,Week 7,,7,February,2,2005-02,Q1,2005-Q1,2005,None,2005-02-16 00:00:00
109,02/17/2005,Thursday,17,48,Week 7,,7,February,2,2005-02,Q1,2005-Q1,2005,None,2005-02-17 00:00:00
110,02/18/2005,Friday,18,49,Week 7,,7,February,2,2005-02,Q1,2005-Q1,2005,None,2005-02-18 00:00:00
111,02/19/2005,Saturday,19,50,Week 8,,8,February,2,2005-02,Q1,2005-Q1,2005,None,2005-02-19 00:00:00
112,02/20/2005,Sunday,20,51,Week 8,,8,February,2,2005-02,Q1,2005-Q1,2005,None,2005-02-20 00:00:00
113,02/21/2005,Monday,21,52,Week 8,,8,February,2,2005-02,Q1,2005-Q1,2005,None,2005-02-21 00:00:00
114,02/22/2005,Tuesday,22,53,Week 8,,8,February,2,2005-02,Q1,2005-Q1,2005,None,2005-02-22 00:00:00
115,02/23/2005,Wednesday,23,54,Week 8,,8,February,2,2005-02,Q1,2005-Q1,2005,None,2005-02-23 00:00:00
116,02/24/2005,Thursday,24,55,Week 8,,8,February,2,2005-02,Q1,2005-Q1,2005,None,2005-02-24 00:00:00
117,02/25/2005,Friday,25,56,Week 8,,8,February,2,2005-02,Q1,2005-Q1,2005,None,2005-02-25 00:00:00
118,02/26/2005,Saturday,26,57,Week 9,,9,February,2,2005-02,Q1,2005-Q1,2005,None,2005-02-26 00:00:00
119,02/27/2005,Sunday,27,58,Week 9,,9,February,2,2005-02,Q1,2005-Q1,2005,None,2005-02-27 00:00:00
120,02/28/2005,Monday,28,59,Week 9,,9,February,2,2005-02,Q1,2005-Q1,2005,None,2005-02-28 00:00:00
121,03/01/2005,Tuesday,1,60,Week 9,,9,March,3,2005-03,Q1,2005-Q1,2005,None,2005-03-01 00:00:00
122,03/02/2005,Wednesday,2,61,Week 9,,9,March,3,2005-03,Q1,2005-Q1,2005,None,2005-03-02 00:00:00
123,03/03/2005,Thursday,3,62,Week 9,,9,March,3,2005-03,Q1,2005-Q1,2005,None,2005-03-03 00:00:00
124,03/04/2005,Friday,4,63,Week 9,,9,March,3,2005-03,Q1,2005-Q1,2005,None,2005-03-04 00:00:00
125,03/05/2005,Saturday,5,64,Week 10,,10,March,3,2005-03,Q1,2005-Q1,2005,None,2005-03-05 00:00:00
126,03/06/2005,Sunday,6,65,Week 10,,10,March,3,2005-03,Q1,2005-Q1,2005,None,2005-03-06 00:00:00
127,03/07/2005,Monday,7,66,Week 10,,10,March,3,2005-03,Q1,2005-Q1,2005,None,2005-03-07 00:00:00
128,03/08/2005,Tuesday,8,67,Week 10,,10,March,3,2005-03,Q1,2005-Q1,2005,None,2005-03-08 00:00:00
129,03/09/2005,Wednesday,9,68,Week 10,,10,March,3,2005-03,Q1,2005-Q1,2005,None,2005-03-09 00:00:00
130,03/10/2005,Thursday,10,69,Week 10,,10,March,3,2005-03,Q1,2005-Q1,2005,None,2005-03-10 00:00:00
131,03/11/2005,Friday,11,70,Week 10,,10,March,3,2005-03,Q1,2005-Q1,2005,None,2005-03-11 00:00:00
132,03/12/2005,Saturday,12,71,Week 11,,11,March,3,2005-03,Q1,2005-Q1,2005,None,2005-03-12 00:00:00
133,03/13/2005,Sunday,13,72,Week 11,,11,March,3,2005-03,Q1,2005-Q1,2005,None,2005-03-13 00:00:00
134,03/14/2005,Monday,14,73,Week 11,,11,March,3,2005-03,Q1,2005-Q1,2005,None,2005-03-14 00:00:00
135,03/15/2005,Tuesday,15,74,Week 11,,11,March,3,2005-03,Q1,2005-Q1,2005,None,2005-03-15 00:00:00
136,03/16/2005,Wednesday,16,75,Week 11,,11,March,3,2005-03,Q1,2005-Q1,2005,None,2005-03-16 00:00:00
137,03/17/2005,Thursday,17,76,Week 11,,11,March,3,2005-03,Q1,2005-Q1,2005,None,2005-03-17 00:00:00
138,03/18/2005,Friday,18,77,Week 11,,11,March,3,2005-03,Q1,2005-Q1,2005,None,2005-03-18 00:00:00
139,03/19/2005,Saturday,19,78,Week 12,,12,March,3,2005-03,Q1,2005-Q1,2005,None,2005-03-19 00:00:00
140,03/20/2005,Sunday,20,79,Week 12,,12,March,3,2005-03,Q1,2005-Q1,2005,None,2005-03-20 00:00:00
141,03/21/2005,Monday,21,80,Week 12,,12,March,3,2005-03,Q1,2005-Q1,2005,None,2005-03-21 00:00:00
142,03/22/2005,Tuesday,22,81,Week 12,,12,March,3,2005-03,Q1,2005-Q1,2005,None,2005-03-22 00:00:00
143,03/23/2005,Wednesday,23,82,Week 12,,12,March,3,2005-03,Q1,2005-Q1,2005,None,2005-03-23 00:00:00
144,03/24/2005,Thursday,24,83,Week 12,,12,March,3,2005-03,Q1,2005-Q1,2005,None,2005-03-24 00:00:00
145,03/25/2005,Friday,25,84,Week 12,,12,March,3,2005-03,Q1,2005-Q1,2005,None,2005-03-25 00:00:00
146,03/26/2005,Saturday,26,85,Week 13,,13,March,3,2005-03,Q1,2005-Q1,2005,None,2005-03-26 00:00:00
147,03/27/2005,Sunday,27,86,Week 13,,13,March,3,2005-03,Q1,2005-Q1,2005,None,2005-03-27 00:00:00
148,03/28/2005,Monday,28,87,Week 13,,13,March,3,2005-03,Q1,2005-Q1,2005,None,2005-03-28 00:00:00
149,03/29/2005,Tuesday,29,88,Week 13,,13,March,3,2005-03,Q1,2005-Q1,2005,None,2005-03-29 00:00:00
150,03/30/2005,Wednesday,30,89,Week 13,,13,March,3,2005-03,Q1,2005-Q1,2005,None,2005-03-30 00:00:00
151,03/31/2005,Thursday,31,90,Week 13,,13,March,3,2005-03,Q1,2005-Q1,2005,None,2005-03-31 00:00:00
152,04/01/2005,Friday,1,91,Week 13,,13,April,4,2005-04,Q2,2005-Q2,2005,None,2005-04-01 00:00:00
153,04/02/2005,Saturday,2,92,Week 14,,14,April,4,2005-04,Q2,2005-Q2,2005,None,2005-04-02 00:00:00
154,04/03/2005,Sunday,3,93,Week 14,,14,April,4,2005-04,Q2,2005-Q2,2005,None,2005-04-03 00:00:00
155,04/04/2005,Monday,4,94,Week 14,,14,April,4,2005-04,Q2,2005-Q2,2005,None,2005-04-04 00:00:00
156,04/05/2005,Tuesday,5,95,Week 14,,14,April,4,2005-04,Q2,2005-Q2,2005,None,2005-04-05 00:00:00
157,04/06/2005,Wednesday,6,96,Week 14,,14,April,4,2005-04,Q2,2005-Q2,2005,None,2005-04-06 00:00:00
158,04/07/2005,Thursday,7,97,Week 14,,14,April,4,2005-04,Q2,2005-Q2,2005,None,2005-04-07 00:00:00
159,04/08/2005,Friday,8,98,Week 14,,14,April,4,2005-04,Q2,2005-Q2,2005,None,2005-04-08 00:00:00
160,04/09/2005,Saturday,9,99,Week 15,,15,April,4,2005-04,Q2,2005-Q2,2005,None,2005-04-09 00:00:00
161,04/10/2005,Sunday,10,100,Week 15,,15,April,4,2005-04,Q2,2005-Q2,2005,None,2005-04-10 00:00:00
162,04/11/2005,Monday,11,101,Week 15,,15,April,4,2005-04,Q2,2005-Q2,2005,None,2005-04-11 00:00:00
163,04/12/2005,Tuesday,12,102,Week 15,,15,April,4,2005-04,Q2,2005-Q2,2005,None,2005-04-12 00:00:00
164,04/13/2005,Wednesday,13,103,Week 15,,15,April,4,2005-04,Q2,2005-Q2,2005,None,2005-04-13 00:00:00
165,04/14/2005,Thursday,14,104,Week 15,,15,April,4,2005-04,Q2,2005-Q2,2005,None,2005-04-14 00:00:00
166,04/15/2005,Friday,15,105,Week 15,,15,April,4,2005-04,Q2,2005-Q2,2005,None,2005-04-15 00:00:00
167,04/16/2005,Saturday,16,106,Week 16,,16,April,4,2005-04,Q2,2005-Q2,2005,None,2005-04-16 00:00:00
168,04/17/2005,Sunday,17,107,Week 16,,16,April,4,2005-04,Q2,2005-Q2,2005,None,2005-04-17 00:00:00
169,04/18/2005,Monday,18,108,Week 16,,16,April,4,2005-04,Q2,2005-Q2,2005,None,2005-04-18 00:00:00
170,04/19/2005,Tuesday,19,109,Week 16,,16,April,4,2005-04,Q2,2005-Q2,2005,None,2005-04-19 00:00:00
171,04/20/2005,Wednesday,20,110,Week 16,,16,April,4,2005-04,Q2,2005-Q2,2005,None,2005-04-20 00:00:00
172,04/21/2005,Thursday,21,111,Week 16,,16,April,4,2005-04,Q2,2005-Q2,2005,None,2005-04-21 00:00:00
173,04/22/2005,Friday,22,112,Week 16,,16,April,4,2005-04,Q2,2005-Q2,2005,None,2005-04-22 00:00:00
174,04/23/2005,Saturday,23,113,Week 17,,17,April,4,2005-04,Q2,2005-Q2,2005,None,2005-04-23 00:00:00
175,04/24/2005,Sunday,24,114,Week 17,,17,April,4,2005-04,Q2,2005-Q2,2005,None,2005-04-24 00:00:00
176,04/25/2005,Monday,25,115,Week 17,,17,April,4,2005-04,Q2,2005-Q2,2005,None,2005-04-25 00:00:00
177,04/26/2005,Tuesday,26,116,Week 17,,17,April,4,2005-04,Q2,2005-Q2,2005,None,2005-04-26 00:00:00
178,04/27/2005,Wednesday,27,117,Week 17,,17,April,4,2005-04,Q2,2005-Q2,2005,None,2005-04-27 00:00:00
179,04/28/2005,Thursday,28,118,Week 17,,17,April,4,2005-04,Q2,2005-Q2,2005,None,2005-04-28 00:00:00
180,04/29/2005,Friday,29,119,Week 17,,17,April,4,2005-04,Q2,2005-Q2,2005,None,2005-04-29 00:00:00
181,04/30/2005,Saturday,30,120,Week 18,,18,April,4,2005-04,Q2,2005-Q2,2005,None,2005-04-30 00:00:00
182,05/01/2005,Sunday,1,121,Week 18,,18,May,5,2005-05,Q2,2005-Q2,2005,None,2005-05-01 00:00:00
183,05/02/2005,Monday,2,122,Week 18,,18,May,5,2005-05,Q2,2005-Q2,2005,None,2005-05-02 00:00:00
184,05/03/2005,Tuesday,3,123,Week 18,,18,May,5,2005-05,Q2,2005-Q2,2005,None,2005-05-03 00:00:00
185,05/04/2005,Wednesday,4,124,Week 18,,18,May,5,2005-05,Q2,2005-Q2,2005,None,2005-05-04 00:00:00
186,05/05/2005,Thursday,5,125,Week 18,,18,May,5,2005-05,Q2,2005-Q2,2005,None,2005-05-05 00:00:00
187,05/06/2005,Friday,6,126,Week 18,,18,May,5,2005-05,Q2,2005-Q2,2005,None,2005-05-06 00:00:00
188,05/07/2005,Saturday,7,127,Week 19,,19,May,5,2005-05,Q2,2005-Q2,2005,None,2005-05-07 00:00:00
189,05/08/2005,Sunday,8,128,Week 19,,19,May,5,2005-05,Q2,2005-Q2,2005,None,2005-05-08 00:00:00
190,05/09/2005,Monday,9,129,Week 19,,19,May,5,2005-05,Q2,2005-Q2,2005,None,2005-05-09 00:00:00
191,05/10/2005,Tuesday,10,130,Week 19,,19,May,5,2005-05,Q2,2005-Q2,2005,None,2005-05-10 00:00:00
192,05/11/2005,Wednesday,11,131,Week 19,,19,May,5,2005-05,Q2,2005-Q2,2005,None,2005-05-11 00:00:00
193,05/12/2005,Thursday,12,132,Week 19,,19,May,5,2005-05,Q2,2005-Q2,2005,None,2005-05-12 00:00:00
194,05/13/2005,Friday,13,133,Week 19,,19,May,5,2005-05,Q2,2005-Q2,2005,None,2005-05-13 00:00:00
195,05/14/2005,Saturday,14,134,Week 20,,20,May,5,2005-05,Q2,2005-Q2,2005,None,2005-05-14 00:00:00
196,05/15/2005,Sunday,15,135,Week 20,,20,May,5,2005-05,Q2,2005-Q2,2005,None,2005-05-15 00:00:00
197,05/16/2005,Monday,16,136,Week 20,,20,May,5,2005-05,Q2,2005-Q2,2005,None,2005-05-16 00:00:00
198,05/17/2005,Tuesday,17,137,Week 20,,20,May,5,2005-05,Q2,2005-Q2,2005,None,2005-05-17 00:00:00
199,05/18/2005,Wednesday,18,138,Week 20,,20,May,5,2005-05,Q2,2005-Q2,2005,None,2005-05-18 00:00:00
200,05/19/2005,Thursday,19,139,Week 20,,20,May,5,2005-05,Q2,2005-Q2,2005,None,2005-05-19 00:00:00
201,05/20/2005,Friday,20,140,Week 20,,20,May,5,2005-05,Q2,2005-Q2,2005,None,2005-05-20 00:00:00
202,05/21/2005,Saturday,21,141,Week 21,,21,May,5,2005-05,Q2,2005-Q2,2005,None,2005-05-21 00:00:00
203,05/22/2005,Sunday,22,142,Week 21,,21,May,5,2005-05,Q2,2005-Q2,2005,None,2005-05-22 00:00:00
204,05/23/2005,Monday,23,143,Week 21,,21,May,5,2005-05,Q2,2005-Q2,2005,None,2005-05-23 00:00:00
205,05/24/2005,Tuesday,24,144,Week 21,,21,May,5,2005-05,Q2,2005-Q2,2005,None,2005-05-24 00:00:00
206,05/25/2005,Wednesday,25,145,Week 21,,21,May,5,2005-05,Q2,2005-Q2,2005,None,2005-05-25 00:00:00
207,05/26/2005,Thursday,26,146,Week 21,,21,May,5,2005-05,Q2,2005-Q2,2005,None,2005-05-26 00:00:00
208,05/27/2005,Friday,27,147,Week 21,,21,May,5,2005-05,Q2,2005-Q2,2005,None,2005-05-27 00:00:00
209,05/28/2005,Saturday,28,148,Week 22,,22,May,5,2005-05,Q2,2005-Q2,2005,None,2005-05-28 00:00:00
210,05/29/2005,Sunday,29,149,Week 22,,22,May,5,2005-05,Q2,2005-Q2,2005,None,2005-05-29 00:00:00
211,05/30/2005,Monday,30,150,Week 22,,22,May,5,2005-05,Q2,2005-Q2,2005,None,2005-05-30 00:00:00
212,05/31/2005,Tuesday,31,151,Week 22,,22,May,5,2005-05,Q2,2005-Q2,2005,None,2005-05-31 00:00:00
213,06/01/2005,Wednesday,1,152,Week 22,,22,June,6,2005-06,Q2,2005-Q2,2005,None,2005-06-01 00:00:00
214,06/02/2005,Thursday,2,153,Week 22,,22,June,6,2005-06,Q2,2005-Q2,2005,None,2005-06-02 00:00:00
215,06/03/2005,Friday,3,154,Week 22,,22,June,6,2005-06,Q2,2005-Q2,2005,None,2005-06-03 00:00:00
216,06/04/2005,Saturday,4,155,Week 23,,23,June,6,2005-06,Q2,2005-Q2,2005,None,2005-06-04 00:00:00
217,06/05/2005,Sunday,5,156,Week 23,,23,June,6,2005-06,Q2,2005-Q2,2005,None,2005-06-05 00:00:00
218,06/06/2005,Monday,6,157,Week 23,,23,June,6,2005-06,Q2,2005-Q2,2005,None,2005-06-06 00:00:00
219,06/07/2005,Tuesday,7,158,Week 23,,23,June,6,2005-06,Q2,2005-Q2,2005,None,2005-06-07 00:00:00
220,06/08/2005,Wednesday,8,159,Week 23,,23,June,6,2005-06,Q2,2005-Q2,2005,None,2005-06-08 00:00:00
221,06/09/2005,Thursday,9,160,Week 23,,23,June,6,2005-06,Q2,2005-Q2,2005,None,2005-06-09 00:00:00
222,06/10/2005,Friday,10,161,Week 23,,23,June,6,2005-06,Q2,2005-Q2,2005,None,2005-06-10 00:00:00
223,06/11/2005,Saturday,11,162,Week 24,,24,June,6,2005-06,Q2,2005-Q2,2005,None,2005-06-11 00:00:00
224,06/12/2005,Sunday,12,163,Week 24,,24,June,6,2005-06,Q2,2005-Q2,2005,None,2005-06-12 00:00:00
225,06/13/2005,Monday,13,164,Week 24,,24,June,6,2005-06,Q2,2005-Q2,2005,None,2005-06-13 00:00:00
226,06/14/2005,Tuesday,14,165,Week 24,,24,June,6,2005-06,Q2,2005-Q2,2005,None,2005-06-14 00:00:00
227,06/15/2005,Wednesday,15,166,Week 24,,24,June,6,2005-06,Q2,2005-Q2,2005,None,2005-06-15 00:00:00
228,06/16/2005,Thursday,16,167,Week 24,,24,June,6,2005-06,Q2,2005-Q2,2005,None,2005-06-16 00:00:00
229,06/17/2005,Friday,17,168,Week 24,,24,June,6,2005-06,Q2,2005-Q2,2005,None,2005-06-17 00:00:00
230,06/18/2005,Saturday,18,169,Week 25,,25,June,6,2005-06,Q2,2005-Q2,2005,None,2005-06-18 00:00:00
231,06/19/2005,Sunday,19,170,Week 25,,25,June,6,2005-06,Q2,2005-Q2,2005,None,2005-06-19 00:00:00
232,06/20/2005,Monday,20,171,Week 25,,25,June,6,2005-06,Q2,2005-Q2,2005,None,2005-06-20 00:00:00
233,06/21/2005,Tuesday,21,172,Week 25,,25,June,6,2005-06,Q2,2005-Q2,2005,None,2005-06-21 00:00:00
234,06/22/2005,Wednesday,22,173,Week 25,,25,June,6,2005-06,Q2,2005-Q2,2005,None,2005-06-22 00:00:00
235,06/23/2005,Thursday,23,174,Week 25,,25,June,6,2005-06,Q2,2005-Q2,2005,None,2005-06-23 00:00:00
236,06/24/2005,Friday,24,175,Week 25,,25,June,6,2005-06,Q2,2005-Q2,2005,None,2005-06-24 00:00:00
237,06/25/2005,Saturday,25,176,Week 26,,26,June,6,2005-06,Q2,2005-Q2,2005,None,2005-06-25 00:00:00
238,06/26/2005,Sunday,26,177,Week 26,,26,June,6,2005-06,Q2,2005-Q2,2005,None,2005-06-26 00:00:00
239,06/27/2005,Monday,27,178,Week 26,,26,June,6,2005-06,Q2,2005-Q2,2005,None,2005-06-27 00:00:00
240,06/28/2005,Tuesday,28,179,Week 26,,26,June,6,2005-06,Q2,2005-Q2,2005,None,2005-06-28 00:00:00
241,06/29/2005,Wednesday,29,180,Week 26,,26,June,6,2005-06,Q2,2005-Q2,2005,None,2005-06-29 00:00:00
242,06/30/2005,Thursday,30,181,Week 26,,26,June,6,2005-06,Q2,2005-Q2,2005,None,2005-06-30 00:00:00
243,07/01/2005,Friday,1,182,Week 26,,26,July,7,2005-07,Q3,2005-Q3,2005,None,2005-07-01 00:00:00
244,07/02/2005,Saturday,2,183,Week 27,,27,July,7,2005-07,Q3,2005-Q3,2005,None,2005-07-02 00:00:00
245,07/03/2005,Sunday,3,184,Week 27,,27,July,7,2005-07,Q3,2005-Q3,2005,None,2005-07-03 00:00:00
246,07/04/2005,Monday,4,185,Week 27,,27,July,7,2005-07,Q3,2005-Q3,2005,None,2005-07-04 00:00:00
247,07/05/2005,Tuesday,5,186,Week 27,,27,July,7,2005-07,Q3,2005-Q3,2005,None,2005-07-05 00:00:00
248,07/06/2005,Wednesday,6,187,Week 27,,27,July,7,2005-07,Q3,2005-Q3,2005,None,2005-07-06 00:00:00
249,07/07/2005,Thursday,7,188,Week 27,,27,July,7,2005-07,Q3,2005-Q3,2005,None,2005-07-07 00:00:00
250,07/08/2005,Friday,8,189,Week 27,,27,July,7,2005-07,Q3,2005-Q3,2005,None,2005-07-08 00:00:00
251,07/09/2005,Saturday,9,190,Week 28,,28,July,7,2005-07,Q3,2005-Q3,2005,None,2005-07-09 00:00:00
252,07/10/2005,Sunday,10,191,Week 28,,28,July,7,2005-07,Q3,2005-Q3,2005,None,2005-07-10 00:00:00
253,07/11/2005,Monday,11,192,Week 28,,28,July,7,2005-07,Q3,2005-Q3,2005,None,2005-07-11 00:00:00
254,07/12/2005,Tuesday,12,193,Week 28,,28,July,7,2005-07,Q3,2005-Q3,2005,None,2005-07-12 00:00:00
255,07/13/2005,Wednesday,13,194,Week 28,,28,July,7,2005-07,Q3,2005-Q3,2005,None,2005-07-13 00:00:00
256,07/14/2005,Thursday,14,195,Week 28,,28,July,7,2005-07,Q3,2005-Q3,2005,None,2005-07-14 00:00:00
257,07/15/2005,Friday,15,196,Week 28,,28,July,7,2005-07,Q3,2005-Q3,2005,None,2005-07-15 00:00:00
258,07/16/2005,Saturday,16,197,Week 29,,29,July,7,2005-07,Q3,2005-Q3,2005,None,2005-07-16 00:00:00
259,07/17/2005,Sunday,17,198,Week 29,,29,July,7,2005-07,Q3,2005-Q3,2005,None,2005-07-17 00:00:00
260,07/18/2005,Monday,18,199,Week 29,,29,July,7,2005-07,Q3,2005-Q3,2005,None,2005-07-18 00:00:00
261,07/19/2005,Tuesday,19,200,Week 29,,29,July,7,2005-07,Q3,2005-Q3,2005,None,2005-07-19 00:00:00
262,07/20/2005,Wednesday,20,201,Week 29,,29,July,7,2005-07,Q3,2005-Q3,2005,None,2005-07-20 00:00:00
263,07/21/2005,Thursday,21,202,Week 29,,29,July,7,2005-07,Q3,2005-Q3,2005,None,2005-07-21 00:00:00
264,07/22/2005,Friday,22,203,Week 29,,29,July,7,2005-07,Q3,2005-Q3,2005,None,2005-07-22 00:00:00
265,07/23/2005,Saturday,23,204,Week 30,,30,July,7,2005-07,Q3,2005-Q3,2005,None,2005-07-23 00:00:00
266,07/24/2005,Sunday,24,205,Week 30,,30,July,7,2005-07,Q3,2005-Q3,2005,None,2005-07-24 00:00:00
267,07/25/2005,Monday,25,206,Week 30,,30,July,7,2005-07,Q3,2005-Q3,2005,None,2005-07-25 00:00:00
268,07/26/2005,Tuesday,26,207,Week 30,,30,July,7,2005-07,Q3,2005-Q3,2005,None,2005-07-26 00:00:00
269,07/27/2005,Wednesday,27,208,Week 30,,30,July,7,2005-07,Q3,2005-Q3,2005,None,2005-07-27 00:00:00
270,07/28/2005,Thursday,28,209,Week 30,,30,July,7,2005-07,Q3,2005-Q3,2005,None,2005-07-28 00:00:00
271,07/29/2005,Friday,29,210,Week 30,,30,July,7,2005-07,Q3,2005-Q3,2005,None,2005-07-29 00:00:00
272,07/30/2005,Saturday,30,211,Week 31,,31,July,7,2005-07,Q3,2005-Q3,2005,None,2005-07-30 00:00:00
273,07/31/2005,Sunday,31,212,Week 31,,31,July,7,2005-07,Q3,2005-Q3,2005,None,2005-07-31 00:00:00
274,08/01/2005,Monday,1,213,Week 31,,31,August,8,2005-08,Q3,2005-Q3,2005,None,2005-08-01 00:00:00
275,08/02/2005,Tuesday,2,214,Week 31,,31,August,8,2005-08,Q3,2005-Q3,2005,None,2005-08-02 00:00:00
276,08/03/2005,Wednesday,3,215,Week 31,,31,August,8,2005-08,Q3,2005-Q3,2005,None,2005-08-03 00:00:00
277,08/04/2005,Thursday,4,216,Week 31,,31,August,8,2005-08,Q3,2005-Q3,2005,None,2005-08-04 00:00:00
278,08/05/2005,Friday,5,217,Week 31,,31,August,8,2005-08,Q3,2005-Q3,2005,None,2005-08-05 00:00:00
279,08/06/2005,Saturday,6,218,Week 32,,32,August,8,2005-08,Q3,2005-Q3,2005,None,2005-08-06 00:00:00
280,08/07/2005,Sunday,7,219,Week 32,,32,August,8,2005-08,Q3,2005-Q3,2005,None,2005-08-07 00:00:00
281,08/08/2005,Monday,8,220,Week 32,,32,August,8,2005-08,Q3,2005-Q3,2005,None,2005-08-08 00:00:00
282,08/09/2005,Tuesday,9,221,Week 32,,32,August,8,2005-08,Q3,2005-Q3,2005,None,2005-08-09 00:00:00
283,08/10/2005,Wednesday,10,222,Week 32,,32,August,8,2005-08,Q3,2005-Q3,2005,None,2005-08-10 00:00:00
284,08/11/2005,Thursday,11,223,Week 32,,32,August,8,2005-08,Q3,2005-Q3,2005,None,2005-08-11 00:00:00
285,08/12/2005,Friday,12,224,Week 32,,32,August,8,2005-08,Q3,2005-Q3,2005,None,2005-08-12 00:00:00
286,08/13/2005,Saturday,13,225,Week 33,,33,August,8,2005-08,Q3,2005-Q3,2005,None,2005-08-13 00:00:00
287,08/14/2005,Sunday,14,226,Week 33,,33,August,8,2005-08,Q3,2005-Q3,2005,None,2005-08-14 00:00:00
288,08/15/2005,Monday,15,227,Week 33,,33,August,8,2005-08,Q3,2005-Q3,2005,None,2005-08-15 00:00:00
289,08/16/2005,Tuesday,16,228,Week 33,,33,August,8,2005-08,Q3,2005-Q3,2005,None,2005-08-16 00:00:00
290,08/17/2005,Wednesday,17,229,Week 33,,33,August,8,2005-08,Q3,2005-Q3,2005,None,2005-08-17 00:00:00
291,08/18/2005,Thursday,18,230,Week 33,,33,August,8,2005-08,Q3,2005-Q3,2005,None,2005-08-18 00:00:00
292,08/19/2005,Friday,19,231,Week 33,,33,August,8,2005-08,Q3,2005-Q3,2005,None,2005-08-19 00:00:00
293,08/20/2005,Saturday,20,232,Week 34,,34,August,8,2005-08,Q3,2005-Q3,2005,None,2005-08-20 00:00:00
294,08/21/2005,Sunday,21,233,Week 34,,34,August,8,2005-08,Q3,2005-Q3,2005,None,2005-08-21 00:00:00
295,08/22/2005,Monday,22,234,Week 34,,34,August,8,2005-08,Q3,2005-Q3,2005,None,2005-08-22 00:00:00
296,08/23/2005,Tuesday,23,235,Week 34,,34,August,8,2005-08,Q3,2005-Q3,2005,None,2005-08-23 00:00:00
297,08/24/2005,Wednesday,24,236,Week 34,,34,August,8,2005-08,Q3,2005-Q3,2005,None,2005-08-24 00:00:00
298,08/25/2005,Thursday,25,237,Week 34,,34,August,8,2005-08,Q3,2005-Q3,2005,None,2005-08-25 00:00:00
299,08/26/2005,Friday,26,238,Week 34,,34,August,8,2005-08,Q3,2005-Q3,2005,None,2005-08-26 00:00:00
300,08/27/2005,Saturday,27,239,Week 35,,35,August,8,2005-08,Q3,2005-Q3,2005,None,2005-08-27 00:00:00
301,08/28/2005,Sunday,28,240,Week 35,,35,August,8,2005-08,Q3,2005-Q3,2005,None,2005-08-28 00:00:00
302,08/29/2005,Monday,29,241,Week 35,,35,August,8,2005-08,Q3,2005-Q3,2005,None,2005-08-29 00:00:00
303,08/30/2005,Tuesday,30,242,Week 35,,35,August,8,2005-08,Q3,2005-Q3,2005,None,2005-08-30 00:00:00
304,08/31/2005,Wednesday,31,243,Week 35,,35,August,8,2005-08,Q3,2005-Q3,2005,None,2005-08-31 00:00:00
305,09/01/2005,Thursday,1,244,Week 35,,35,September,9,2005-09,Q3,2005-Q3,2005,None,2005-09-01 00:00:00
306,09/02/2005,Friday,2,245,Week 35,,35,September,9,2005-09,Q3,2005-Q3,2005,None,2005-09-02 00:00:00
307,09/03/2005,Saturday,3,246,Week 36,,36,September,9,2005-09,Q3,2005-Q3,2005,None,2005-09-03 00:00:00
308,09/04/2005,Sunday,4,247,Week 36,,36,September,9,2005-09,Q3,2005-Q3,2005,None,2005-09-04 00:00:00
309,09/05/2005,Monday,5,248,Week 36,,36,September,9,2005-09,Q3,2005-Q3,2005,None,2005-09-05 00:00:00
310,09/06/2005,Tuesday,6,249,Week 36,,36,September,9,2005-09,Q3,2005-Q3,2005,None,2005-09-06 00:00:00
311,09/07/2005,Wednesday,7,250,Week 36,,36,September,9,2005-09,Q3,2005-Q3,2005,None,2005-09-07 00:00:00
312,09/08/2005,Thursday,8,251,Week 36,,36,September,9,2005-09,Q3,2005-Q3,2005,None,2005-09-08 00:00:00
313,09/09/2005,Friday,9,252,Week 36,,36,September,9,2005-09,Q3,2005-Q3,2005,None,2005-09-09 00:00:00
314,09/10/2005,Saturday,10,253,Week 37,,37,September,9,2005-09,Q3,2005-Q3,2005,None,2005-09-10 00:00:00
315,09/11/2005,Sunday,11,254,Week 37,,37,September,9,2005-09,Q3,2005-Q3,2005,None,2005-09-11 00:00:00
316,09/12/2005,Monday,12,255,Week 37,,37,September,9,2005-09,Q3,2005-Q3,2005,None,2005-09-12 00:00:00
317,09/13/2005,Tuesday,13,256,Week 37,,37,September,9,2005-09,Q3,2005-Q3,2005,None,2005-09-13 00:00:00
318,09/14/2005,Wednesday,14,257,Week 37,,37,September,9,2005-09,Q3,2005-Q3,2005,None,2005-09-14 00:00:00
319,09/15/2005,Thursday,15,258,Week 37,,37,September,9,2005-09,Q3,2005-Q3,2005,None,2005-09-15 00:00:00
320,09/16/2005,Friday,16,259,Week 37,,37,September,9,2005-09,Q3,2005-Q3,2005,None,2005-09-16 00:00:00
321,09/17/2005,Saturday,17,260,Week 38,,38,September,9,2005-09,Q3,2005-Q3,2005,None,2005-09-17 00:00:00
322,09/18/2005,Sunday,18,261,Week 38,,38,September,9,2005-09,Q3,2005-Q3,2005,None,2005-09-18 00:00:00
323,09/19/2005,Monday,19,262,Week 38,,38,September,9,2005-09,Q3,2005-Q3,2005,None,2005-09-19 00:00:00
324,09/20/2005,Tuesday,20,263,Week 38,,38,September,9,2005-09,Q3,2005-Q3,2005,None,2005-09-20 00:00:00
325,09/21/2005,Wednesday,21,264,Week 38,,38,September,9,2005-09,Q3,2005-Q3,2005,None,2005-09-21 00:00:00
326,09/22/2005,Thursday,22,265,Week 38,,38,September,9,2005-09,Q3,2005-Q3,2005,None,2005-09-22 00:00:00
327,09/23/2005,Friday,23,266,Week 38,,38,September,9,2005-09,Q3,2005-Q3,2005,None,2005-09-23 00:00:00
328,09/24/2005,Saturday,24,267,Week 39,,39,September,9,2005-09,Q3,2005-Q3,2005,None,2005-09-24 00:00:00
329,09/25/2005,Sunday,25,268,Week 39,,39,September,9,2005-09,Q3,2005-Q3,2005,None,2005-09-25 00:00:00
330,09/26/2005,Monday,26,269,Week 39,,39,September,9,2005-09,Q3,2005-Q3,2005,None,2005-09-26 00:00:00
331,09/27/2005,Tuesday,27,270,Week 39,,39,September,9,2005-09,Q3,2005-Q3,2005,None,2005-09-27 00:00:00
332,09/28/2005,Wednesday,28,271,Week 39,,39,September,9,2005-09,Q3,2005-Q3,2005,None,2005-09-28 00:00:00
333,09/29/2005,Thursday,29,272,Week 39,,39,September,9,2005-09,Q3,2005-Q3,2005,None,2005-09-29 00:00:00
334,09/30/2005,Friday,30,273,Week 39,,39,September,9,2005-09,Q3,2005-Q3,2005,None,2005-09-30 00:00:00
335,10/01/2005,Saturday,1,274,Week 40,,40,October,10,2005-10,Q4,2005-Q4,2005,None,2005-10-01 00:00:00
336,10/02/2005,Sunday,2,275,Week 40,,40,October,10,2005-10,Q4,2005-Q4,2005,None,2005-10-02 00:00:00
337,10/03/2005,Monday,3,276,Week 40,,40,October,10,2005-10,Q4,2005-Q4,2005,None,2005-10-03 00:00:00
338,10/04/2005,Tuesday,4,277,Week 40,,40,October,10,2005-10,Q4,2005-Q4,2005,None,2005-10-04 00:00:00
339,10/05/2005,Wednesday,5,278,Week 40,,40,October,10,2005-10,Q4,2005-Q4,2005,None,2005-10-05 00:00:00
340,10/06/2005,Thursday,6,279,Week 40,,40,October,10,2005-10,Q4,2005-Q4,2005,None,2005-10-06 00:00:00
341,10/07/2005,Friday,7,280,Week 40,,40,October,10,2005-10,Q4,2005-Q4,2005,None,2005-10-07 00:00:00
342,10/08/2005,Saturday,8,281,Week 41,,41,October,10,2005-10,Q4,2005-Q4,2005,None,2005-10-08 00:00:00
343,10/09/2005,Sunday,9,282,Week 41,,41,October,10,2005-10,Q4,2005-Q4,2005,None,2005-10-09 00:00:00
344,10/10/2005,Monday,10,283,Week 41,,41,October,10,2005-10,Q4,2005-Q4,2005,None,2005-10-10 00:00:00
345,10/11/2005,Tuesday,11,284,Week 41,,41,October,10,2005-10,Q4,2005-Q4,2005,None,2005-10-11 00:00:00
346,10/12/2005,Wednesday,12,285,Week 41,,41,October,10,2005-10,Q4,2005-Q4,2005,None,2005-10-12 00:00:00
347,10/13/2005,Thursday,13,286,Week 41,,41,October,10,2005-10,Q4,2005-Q4,2005,None,2005-10-13 00:00:00
348,10/14/2005,Friday,14,287,Week 41,,41,October,10,2005-10,Q4,2005-Q4,2005,None,2005-10-14 00:00:00
349,10/15/2005,Saturday,15,288,Week 42,,42,October,10,2005-10,Q4,2005-Q4,2005,None,2005-10-15 00:00:00
350,10/16/2005,Sunday,16,289,Week 42,,42,October,10,2005-10,Q4,2005-Q4,2005,None,2005-10-16 00:00:00
351,10/17/2005,Monday,17,290,Week 42,,42,October,10,2005-10,Q4,2005-Q4,2005,None,2005-10-17 00:00:00
352,10/18/2005,Tuesday,18,291,Week 42,,42,October,10,2005-10,Q4,2005-Q4,2005,None,2005-10-18 00:00:00
353,10/19/2005,Wednesday,19,292,Week 42,,42,October,10,2005-10,Q4,2005-Q4,2005,None,2005-10-19 00:00:00
354,10/20/2005,Thursday,20,293,Week 42,,42,October,10,2005-10,Q4,2005-Q4,2005,None,2005-10-20 00:00:00
355,10/21/2005,Friday,21,294,Week 42,,42,October,10,2005-10,Q4,2005-Q4,2005,None,2005-10-21 00:00:00
356,10/22/2005,Saturday,22,295,Week 43,,43,October,10,2005-10,Q4,2005-Q4,2005,None,2005-10-22 00:00:00
357,10/23/2005,Sunday,23,296,Week 43,,43,October,10,2005-10,Q4,2005-Q4,2005,None,2005-10-23 00:00:00
358,10/24/2005,Monday,24,297,Week 43,,43,October,10,2005-10,Q4,2005-Q4,2005,None,2005-10-24 00:00:00
359,10/25/2005,Tuesday,25,298,Week 43,,43,October,10,2005-10,Q4,2005-Q4,2005,None,2005-10-25 00:00:00
360,10/26/2005,Wednesday,26,299,Week 43,,43,October,10,2005-10,Q4,2005-Q4,2005,None,2005-10-26 00:00:00
361,10/27/2005,Thursday,27,300,Week 43,,43,October,10,2005-10,Q4,2005-Q4,2005,None,2005-10-27 00:00:00
362,10/28/2005,Friday,28,301,Week 43,,43,October,10,2005-10,Q4,2005-Q4,2005,None,2005-10-28 00:00:00
363,10/29/2005,Saturday,29,302,Week 44,,44,October,10,2005-10,Q4,2005-Q4,2005,None,2005-10-29 00:00:00
364,10/30/2005,Sunday,30,303,Week 44,,44,October,10,2005-10,Q4,2005-Q4,2005,None,2005-10-30 00:00:00
365,10/31/2005,Monday,31,304,Week 44,,44,October,10,2005-10,Q4,2005-Q4,2005,None,2005-10-31 00:00:00
366,11/01/2005,Tuesday,1,305,Week 44,,44,November,11,2005-11,Q4,2005-Q4,2005,None,2005-11-01 00:00:00
367,11/02/2005,Wednesday,2,306,Week 44,,44,November,11,2005-11,Q4,2005-Q4,2005,None,2005-11-02 00:00:00
368,11/03/2005,Thursday,3,307,Week 44,,44,November,11,2005-11,Q4,2005-Q4,2005,None,2005-11-03 00:00:00
369,11/04/2005,Friday,4,308,Week 44,,44,November,11,2005-11,Q4,2005-Q4,2005,None,2005-11-04 00:00:00
370,11/05/2005,Saturday,5,309,Week 45,,45,November,11,2005-11,Q4,2005-Q4,2005,None,2005-11-05 00:00:00
371,11/06/2005,Sunday,6,310,Week 45,,45,November,11,2005-11,Q4,2005-Q4,2005,None,2005-11-06 00:00:00
372,11/07/2005,Monday,7,311,Week 45,,45,November,11,2005-11,Q4,2005-Q4,2005,None,2005-11-07 00:00:00
373,11/08/2005,Tuesday,8,312,Week 45,,45,November,11,2005-11,Q4,2005-Q4,2005,None,2005-11-08 00:00:00
374,11/09/2005,Wednesday,9,313,Week 45,,45,November,11,2005-11,Q4,2005-Q4,2005,None,2005-11-09 00:00:00
375,11/10/2005,Thursday,10,314,Week 45,,45,November,11,2005-11,Q4,2005-Q4,2005,None,2005-11-10 00:00:00
376,11/11/2005,Friday,11,315,Week 45,,45,November,11,2005-11,Q4,2005-Q4,2005,None,2005-11-11 00:00:00
377,11/12/2005,Saturday,12,316,Week 46,,46,November,11,2005-11,Q4,2005-Q4,2005,None,2005-11-12 00:00:00
378,11/13/2005,Sunday,13,317,Week 46,,46,November,11,2005-11,Q4,2005-Q4,2005,None,2005-11-13 00:00:00
379,11/14/2005,Monday,14,318,Week 46,,46,November,11,2005-11,Q4,2005-Q4,2005,None,2005-11-14 00:00:00
380,11/15/2005,Tuesday,15,319,Week 46,,46,November,11,2005-11,Q4,2005-Q4,2005,None,2005-11-15 00:00:00
381,11/16/2005,Wednesday,16,320,Week 46,,46,November,11,2005-11,Q4,2005-Q4,2005,None,2005-11-16 00:00:00
382,11/17/2005,Thursday,17,321,Week 46,,46,November,11,2005-11,Q4,2005-Q4,2005,None,2005-11-17 00:00:00
383,11/18/2005,Friday,18,322,Week 46,,46,November,11,2005-11,Q4,2005-Q4,2005,None,2005-11-18 00:00:00
384,11/19/2005,Saturday,19,323,Week 47,,47,November,11,2005-11,Q4,2005-Q4,2005,None,2005-11-19 00:00:00
385,11/20/2005,Sunday,20,324,Week 47,,47,November,11,2005-11,Q4,2005-Q4,2005,None,2005-11-20 00:00:00
386,11/21/2005,Monday,21,325,Week 47,,47,November,11,2005-11,Q4,2005-Q4,2005,None,2005-11-21 00:00:00
387,11/22/2005,Tuesday,22,326,Week 47,,47,November,11,2005-11,Q4,2005-Q4,2005,None,2005-11-22 00:00:00
388,11/23/2005,Wednesday,23,327,Week 47,,47,November,11,2005-11,Q4,2005-Q4,2005,None,2005-11-23 00:00:00
389,11/24/2005,Thursday,24,328,Week 47,,47,November,11,2005-11,Q4,2005-Q4,2005,None,2005-11-24 00:00:00
390,11/25/2005,Friday,25,329,Week 47,,47,November,11,2005-11,Q4,2005-Q4,2005,None,2005-11-25 00:00:00
391,11/26/2005,Saturday,26,330,Week 48,,48,November,11,2005-11,Q4,2005-Q4,2005,None,2005-11-26 00:00:00
392,11/27/2005,Sunday,27,331,Week 48,,48,November,11,2005-11,Q4,2005-Q4,2005,None,2005-11-27 00:00:00
393,11/28/2005,Monday,28,332,Week 48,,48,November,11,2005-11,Q4,2005-Q4,2005,None,2005-11-28 00:00:00
394,11/29/2005,Tuesday,29,333,Week 48,,48,November,11,2005-11,Q4,2005-Q4,2005,None,2005-11-29 00:00:00
395,11/30/2005,Wednesday,30,334,Week 48,,48,November,11,2005-11,Q4,2005-Q4,2005,None,2005-11-30 00:00:00
396,12/01/2005,Thursday,1,335,Week 48,,48,December,12,2005-12,Q4,2005-Q4,2005,None,2005-12-01 00:00:00
397,12/02/2005,Friday,2,336,Week 48,,48,December,12,2005-12,Q4,2005-Q4,2005,None,2005-12-02 00:00:00
398,12/03/2005,Saturday,3,337,Week 49,,49,December,12,2005-12,Q4,2005-Q4,2005,None,2005-12-03 00:00:00
399,12/04/2005,Sunday,4,338,Week 49,,49,December,12,2005-12,Q4,2005-Q4,2005,None,2005-12-04 00:00:00
400,12/05/2005,Monday,5,339,Week 49,,49,December,12,2005-12,Q4,2005-Q4,2005,None,2005-12-05 00:00:00
401,12/06/2005,Tuesday,6,340,Week 49,,49,December,12,2005-12,Q4,2005-Q4,2005,None,2005-12-06 00:00:00
402,12/07/2005,Wednesday,7,341,Week 49,,49,December,12,2005-12,Q4,2005-Q4,2005,None,2005-12-07 00:00:00
403,12/08/2005,Thursday,8,342,Week 49,,49,December,12,2005-12,Q4,2005-Q4,2005,None,2005-12-08 00:00:00
404,12/09/2005,Friday,9,343,Week 49,,49,December,12,2005-12,Q4,2005-Q4,2005,None,2005-12-09 00:00:00
405,12/10/2005,Saturday,10,344,Week 50,,50,December,12,2005-12,Q4,2005-Q4,2005,None,2005-12-10 00:00:00
406,12/11/2005,Sunday,11,345,Week 50,,50,December,12,2005-12,Q4,2005-Q4,2005,None,2005-12-11 00:00:00
407,12/12/2005,Monday,12,346,Week 50,,50,December,12,2005-12,Q4,2005-Q4,2005,None,2005-12-12 00:00:00
408,12/13/2005,Tuesday,13,347,Week 50,,50,December,12,2005-12,Q4,2005-Q4,2005,None,2005-12-13 00:00:00
409,12/14/2005,Wednesday,14,348,Week 50,,50,December,12,2005-12,Q4,2005-Q4,2005,None,2005-12-14 00:00:00
410,12/15/2005,Thursday,15,349,Week 50,,50,December,12,2005-12,Q4,2005-Q4,2005,None,2005-12-15 00:00:00
411,12/16/2005,Friday,16,350,Week 50,,50,December,12,2005-12,Q4,2005-Q4,2005,None,2005-12-16 00:00:00
412,12/17/2005,Saturday,17,351,Week 51,,51,December,12,2005-12,Q4,2005-Q4,2005,None,2005-12-17 00:00:00
413,12/18/2005,Sunday,18,352,Week 51,,51,December,12,2005-12,Q4,2005-Q4,2005,None,2005-12-18 00:00:00
414,12/19/2005,Monday,19,353,Week 51,,51,December,12,2005-12,Q4,2005-Q4,2005,None,2005-12-19 00:00:00
415,12/20/2005,Tuesday,20,354,Week 51,,51,December,12,2005-12,Q4,2005-Q4,2005,None,2005-12-20 00:00:00
416,12/21/2005,Wednesday,21,355,Week 51,,51,December,12,2005-12,Q4,2005-Q4,2005,None,2005-12-21 00:00:00
417,12/22/2005,Thursday,22,356,Week 51,,51,December,12,2005-12,Q4,2005-Q4,2005,None,2005-12-22 00:00:00
418,12/23/2005,Friday,23,357,Week 51,,51,December,12,2005-12,Q4,2005-Q4,2005,None,2005-12-23 00:00:00
419,12/24/2005,Saturday,24,358,Week 52,,52,December,12,2005-12,Q4,2005-Q4,2005,None,2005-12-24 00:00:00
420,12/25/2005,Sunday,25,359,Week 52,,52,December,12,2005-12,Q4,2005-Q4,2005,None,2005-12-25 00:00:00
421,12/26/2005,Monday,26,360,Week 52,,52,December,12,2005-12,Q4,2005-Q4,2005,None,2005-12-26 00:00:00
422,12/27/2005,Tuesday,27,361,Week 52,,52,December,12,2005-12,Q4,2005-Q4,2005,None,2005-12-27 00:00:00
423,12/28/2005,Wednesday,28,362,Week 52,,52,December,12,2005-12,Q4,2005-Q4,2005,None,2005-12-28 00:00:00
424,12/29/2005,Thursday,29,363,Week 52,,52,December,12,2005-12,Q4,2005-Q4,2005,None,2005-12-29 00:00:00
425,12/30/2005,Friday,30,364,Week 52,,52,December,12,2005-12,Q4,2005-Q4,2005,None,2005-12-30 00:00:00
426,12/31/2005,Saturday,31,365,Week 52,,52,December,12,2005-12,Q4,2005-Q4,2005,None,2005-12-31 00:00:00
427,01/01/2006,Sunday,1,1,Week 1,,1,January,1,2006-01,Q1,2006-Q1,2006,None,2006-01-01 00:00:00
428,01/02/2006,Monday,2,2,Week 1,,1,January,1,2006-01,Q1,2006-Q1,2006,None,2006-01-02 00:00:00
429,01/03/2006,Tuesday,3,3,Week 1,,1,January,1,2006-01,Q1,2006-Q1,2006,None,2006-01-03 00:00:00
430,01/04/2006,Wednesday,4,4,Week 1,,1,January,1,2006-01,Q1,2006-Q1,2006,None,2006-01-04 00:00:00
431,01/05/2006,Thursday,5,5,Week 1,,1,January,1,2006-01,Q1,2006-Q1,2006,None,2006-01-05 00:00:00
432,01/06/2006,Friday,6,6,Week 1,,1,January,1,2006-01,Q1,2006-Q1,2006,None,2006-01-06 00:00:00
433,01/07/2006,Saturday,7,7,Week 1,,1,January,1,2006-01,Q1,2006-Q1,2006,None,2006-01-07 00:00:00
434,01/08/2006,Sunday,8,8,Week 2,,2,January,1,2006-01,Q1,2006-Q1,2006,None,2006-01-08 00:00:00
435,01/09/2006,Monday,9,9,Week 2,,2,January,1,2006-01,Q1,2006-Q1,2006,None,2006-01-09 00:00:00
436,01/10/2006,Tuesday,10,10,Week 2,,2,January,1,2006-01,Q1,2006-Q1,2006,None,2006-01-10 00:00:00
437,01/11/2006,Wednesday,11,11,Week 2,,2,January,1,2006-01,Q1,2006-Q1,2006,None,2006-01-11 00:00:00
438,01/12/2006,Thursday,12,12,Week 2,,2,January,1,2006-01,Q1,2006-Q1,2006,None,2006-01-12 00:00:00
439,01/13/2006,Friday,13,13,Week 2,,2,January,1,2006-01,Q1,2006-Q1,2006,None,2006-01-13 00:00:00
440,01/14/2006,Saturday,14,14,Week 2,,2,January,1,2006-01,Q1,2006-Q1,2006,None,2006-01-14 00:00:00
441,01/15/2006,Sunday,15,15,Week 3,,3,January,1,2006-01,Q1,2006-Q1,2006,None,2006-01-15 00:00:00
442,01/16/2006,Monday,16,16,Week 3,,3,January,1,2006-01,Q1,2006-Q1,2006,None,2006-01-16 00:00:00
443,01/17/2006,Tuesday,17,17,Week 3,,3,January,1,2006-01,Q1,2006-Q1,2006,None,2006-01-17 00:00:00
444,01/18/2006,Wednesday,18,18,Week 3,,3,January,1,2006-01,Q1,2006-Q1,2006,None,2006-01-18 00:00:00
445,01/19/2006,Thursday,19,19,Week 3,,3,January,1,2006-01,Q1,2006-Q1,2006,None,2006-01-19 00:00:00
446,01/20/2006,Friday,20,20,Week 3,,3,January,1,2006-01,Q1,2006-Q1,2006,None,2006-01-20 00:00:00
447,01/21/2006,Saturday,21,21,Week 3,,3,January,1,2006-01,Q1,2006-Q1,2006,None,2006-01-21 00:00:00
448,01/22/2006,Sunday,22,22,Week 4,,4,January,1,2006-01,Q1,2006-Q1,2006,None,2006-01-22 00:00:00
449,01/23/2006,Monday,23,23,Week 4,,4,January,1,2006-01,Q1,2006-Q1,2006,None,2006-01-23 00:00:00
450,01/24/2006,Tuesday,24,24,Week 4,,4,January,1,2006-01,Q1,2006-Q1,2006,None,2006-01-24 00:00:00
451,01/25/2006,Wednesday,25,25,Week 4,,4,January,1,2006-01,Q1,2006-Q1,2006,None,2006-01-25 00:00:00
452,01/26/2006,Thursday,26,26,Week 4,,4,January,1,2006-01,Q1,2006-Q1,2006,None,2006-01-26 00:00:00
453,01/27/2006,Friday,27,27,Week 4,,4,January,1,2006-01,Q1,2006-Q1,2006,None,2006-01-27 00:00:00
454,01/28/2006,Saturday,28,28,Week 4,,4,January,1,2006-01,Q1,2006-Q1,2006,None,2006-01-28 00:00:00
455,01/29/2006,Sunday,29,29,Week 5,,5,January,1,2006-01,Q1,2006-Q1,2006,None,2006-01-29 00:00:00
456,01/30/2006,Monday,30,30,Week 5,,5,January,1,2006-01,Q1,2006-Q1,2006,None,2006-01-30 00:00:00
457,01/31/2006,Tuesday,31,31,Week 5,,5,January,1,2006-01,Q1,2006-Q1,2006,None,2006-01-31 00:00:00
458,02/01/2006,Wednesday,1,32,Week 5,,5,February,2,2006-02,Q1,2006-Q1,2006,None,2006-02-01 00:00:00
459,02/02/2006,Thursday,2,33,Week 5,,5,February,2,2006-02,Q1,2006-Q1,2006,None,2006-02-02 00:00:00
460,02/03/2006,Friday,3,34,Week 5,,5,February,2,2006-02,Q1,2006-Q1,2006,None,2006-02-03 00:00:00
461,02/04/2006,Saturday,4,35,Week 5,,5,February,2,2006-02,Q1,2006-Q1,2006,None,2006-02-04 00:00:00
462,02/05/2006,Sunday,5,36,Week 6,,6,February,2,2006-02,Q1,2006-Q1,2006,None,2006-02-05 00:00:00
463,02/06/2006,Monday,6,37,Week 6,,6,February,2,2006-02,Q1,2006-Q1,2006,None,2006-02-06 00:00:00
464,02/07/2006,Tuesday,7,38,Week 6,,6,February,2,2006-02,Q1,2006-Q1,2006,None,2006-02-07 00:00:00
465,02/08/2006,Wednesday,8,39,Week 6,,6,February,2,2006-02,Q1,2006-Q1,2006,None,2006-02-08 00:00:00
466,02/09/2006,Thursday,9,40,Week 6,,6,February,2,2006-02,Q1,2006-Q1,2006,None,2006-02-09 00:00:00
467,02/10/2006,Friday,10,41,Week 6,,6,February,2,2006-02,Q1,2006-Q1,2006,None,2006-02-10 00:00:00
468,02/11/2006,Saturday,11,42,Week 6,,6,February,2,2006-02,Q1,2006-Q1,2006,None,2006-02-11 00:00:00
469,02/12/2006,Sunday,12,43,Week 7,,7,February,2,2006-02,Q1,2006-Q1,2006,None,2006-02-12 00:00:00
470,02/13/2006,Monday,13,44,Week 7,,7,February,2,2006-02,Q1,2006-Q1,2006,None,2006-02-13 00:00:00
471,02/14/2006,Tuesday,14,45,Week 7,,7,February,2,2006-02,Q1,2006-Q1,2006,None,2006-02-14 00:00:00
472,02/15/2006,Wednesday,15,46,Week 7,,7,February,2,2006-02,Q1,2006-Q1,2006,None,2006-02-15 00:00:00
473,02/16/2006,Thursday,16,47,Week 7,,7,February,2,2006-02,Q1,2006-Q1,2006,None,2006-02-16 00:00:00
474,02/17/2006,Friday,17,48,Week 7,,7,February,2,2006-02,Q1,2006-Q1,2006,None,2006-02-17 00:00:00
475,02/18/2006,Saturday,18,49,Week 7,,7,February,2,2006-02,Q1,2006-Q1,2006,None,2006-02-18 00:00:00
476,02/19/2006,Sunday,19,50,Week 8,,8,February,2,2006-02,Q1,2006-Q1,2006,None,2006-02-19 00:00:00
477,02/20/2006,Monday,20,51,Week 8,,8,February,2,2006-02,Q1,2006-Q1,2006,None,2006-02-20 00:00:00
478,02/21/2006,Tuesday,21,52,Week 8,,8,February,2,2006-02,Q1,2006-Q1,2006,None,2006-02-21 00:00:00
479,02/22/2006,Wednesday,22,53,Week 8,,8,February,2,2006-02,Q1,2006-Q1,2006,None,2006-02-22 00:00:00
480,02/23/2006,Thursday,23,54,Week 8,,8,February,2,2006-02,Q1,2006-Q1,2006,None,2006-02-23 00:00:00
481,02/24/2006,Friday,24,55,Week 8,,8,February,2,2006-02,Q1,2006-Q1,2006,None,2006-02-24 00:00:00
482,02/25/2006,Saturday,25,56,Week 8,,8,February,2,2006-02,Q1,2006-Q1,2006,None,2006-02-25 00:00:00
483,02/26/2006,Sunday,26,57,Week 9,,9,February,2,2006-02,Q1,2006-Q1,2006,None,2006-02-26 00:00:00
484,02/27/2006,Monday,27,58,Week 9,,9,February,2,2006-02,Q1,2006-Q1,2006,None,2006-02-27 00:00:00
485,02/28/2006,Tuesday,28,59,Week 9,,9,February,2,2006-02,Q1,2006-Q1,2006,None,2006-02-28 00:00:00
486,03/01/2006,Wednesday,1,60,Week 9,,9,March,3,2006-03,Q1,2006-Q1,2006,None,2006-03-01 00:00:00
487,03/02/2006,Thursday,2,61,Week 9,,9,March,3,2006-03,Q1,2006-Q1,2006,None,2006-03-02 00:00:00
488,03/03/2006,Friday,3,62,Week 9,,9,March,3,2006-03,Q1,2006-Q1,2006,None,2006-03-03 00:00:00
489,03/04/2006,Saturday,4,63,Week 9,,9,March,3,2006-03,Q1,2006-Q1,2006,None,2006-03-04 00:00:00
490,03/05/2006,Sunday,5,64,Week 10,,10,March,3,2006-03,Q1,2006-Q1,2006,None,2006-03-05 00:00:00
491,03/06/2006,Monday,6,65,Week 10,,10,March,3,2006-03,Q1,2006-Q1,2006,None,2006-03-06 00:00:00
492,03/07/2006,Tuesday,7,66,Week 10,,10,March,3,2006-03,Q1,2006-Q1,2006,None,2006-03-07 00:00:00
493,03/08/2006,Wednesday,8,67,Week 10,,10,March,3,2006-03,Q1,2006-Q1,2006,None,2006-03-08 00:00:00
494,03/09/2006,Thursday,9,68,Week 10,,10,March,3,2006-03,Q1,2006-Q1,2006,None,2006-03-09 00:00:00
495,03/10/2006,Friday,10,69,Week 10,,10,March,3,2006-03,Q1,2006-Q1,2006,None,2006-03-10 00:00:00
496,03/11/2006,Saturday,11,70,Week 10,,10,March,3,2006-03,Q1,2006-Q1,2006,None,2006-03-11 00:00:00
497,03/12/2006,Sunday,12,71,Week 11,,11,March,3,2006-03,Q1,2006-Q1,2006,None,2006-03-12 00:00:00
498,03/13/2006,Monday,13,72,Week 11,,11,March,3,2006-03,Q1,2006-Q1,2006,None,2006-03-13 00:00:00
499,03/14/2006,Tuesday,14,73,Week 11,,11,March,3,2006-03,Q1,2006-Q1,2006,None,2006-03-14 00:00:00
500,03/15/2006,Wednesday,15,74,Week 11,,11,March,3,2006-03,Q1,2006-Q1,2006,None,2006-03-15 00:00:00
501,03/16/2006,Thursday,16,75,Week 11,,11,March,3,2006-03,Q1,2006-Q1,2006,None,2006-03-16 00:00:00
502,03/17/2006,Friday,17,76,Week 11,,11,March,3,2006-03,Q1,2006-Q1,2006,None,2006-03-17 00:00:00
503,03/18/2006,Saturday,18,77,Week 11,,11,March,3,2006-03,Q1,2006-Q1,2006,None,2006-03-18 00:00:00
504,03/19/2006,Sunday,19,78,Week 12,,12,March,3,2006-03,Q1,2006-Q1,2006,None,2006-03-19 00:00:00
505,03/20/2006,Monday,20,79,Week 12,,12,March,3,2006-03,Q1,2006-Q1,2006,None,2006-03-20 00:00:00
506,03/21/2006,Tuesday,21,80,Week 12,,12,March,3,2006-03,Q1,2006-Q1,2006,None,2006-03-21 00:00:00
507,03/22/2006,Wednesday,22,81,Week 12,,12,March,3,2006-03,Q1,2006-Q1,2006,None,2006-03-22 00:00:00
508,03/23/2006,Thursday,23,82,Week 12,,12,March,3,2006-03,Q1,2006-Q1,2006,None,2006-03-23 00:00:00
509,03/24/2006,Friday,24,83,Week 12,,12,March,3,2006-03,Q1,2006-Q1,2006,None,2006-03-24 00:00:00
510,03/25/2006,Saturday,25,84,Week 12,,12,March,3,2006-03,Q1,2006-Q1,2006,None,2006-03-25 00:00:00
511,03/26/2006,Sunday,26,85,Week 13,,13,March,3,2006-03,Q1,2006-Q1,2006,None,2006-03-26 00:00:00
512,03/27/2006,Monday,27,86,Week 13,,13,March,3,2006-03,Q1,2006-Q1,2006,None,2006-03-27 00:00:00
513,03/28/2006,Tuesday,28,87,Week 13,,13,March,3,2006-03,Q1,2006-Q1,2006,None,2006-03-28 00:00:00
514,03/29/2006,Wednesday,29,88,Week 13,,13,March,3,2006-03,Q1,2006-Q1,2006,None,2006-03-29 00:00:00
515,03/30/2006,Thursday,30,89,Week 13,,13,March,3,2006-03,Q1,2006-Q1,2006,None,2006-03-30 00:00:00
516,03/31/2006,Friday,31,90,Week 13,,13,March,3,2006-03,Q1,2006-Q1,2006,None,2006-03-31 00:00:00
517,04/01/2006,Saturday,1,91,Week 13,,13,April,4,2006-04,Q2,2006-Q2,2006,None,2006-04-01 00:00:00
518,04/02/2006,Sunday,2,92,Week 14,,14,April,4,2006-04,Q2,2006-Q2,2006,None,2006-04-02 00:00:00
519,04/03/2006,Monday,3,93,Week 14,,14,April,4,2006-04,Q2,2006-Q2,2006,None,2006-04-03 00:00:00
520,04/04/2006,Tuesday,4,94,Week 14,,14,April,4,2006-04,Q2,2006-Q2,2006,None,2006-04-04 00:00:00
521,04/05/2006,Wednesday,5,95,Week 14,,14,April,4,2006-04,Q2,2006-Q2,2006,None,2006-04-05 00:00:00
522,04/06/2006,Thursday,6,96,Week 14,,14,April,4,2006-04,Q2,2006-Q2,2006,None,2006-04-06 00:00:00
523,04/07/2006,Friday,7,97,Week 14,,14,April,4,2006-04,Q2,2006-Q2,2006,None,2006-04-07 00:00:00
524,04/08/2006,Saturday,8,98,Week 14,,14,April,4,2006-04,Q2,2006-Q2,2006,None,2006-04-08 00:00:00
525,04/09/2006,Sunday,9,99,Week 15,,15,April,4,2006-04,Q2,2006-Q2,2006,None,2006-04-09 00:00:00
526,04/10/2006,Monday,10,100,Week 15,,15,April,4,2006-04,Q2,2006-Q2,2006,None,2006-04-10 00:00:00
527,04/11/2006,Tuesday,11,101,Week 15,,15,April,4,2006-04,Q2,2006-Q2,2006,None,2006-04-11 00:00:00
528,04/12/2006,Wednesday,12,102,Week 15,,15,April,4,2006-04,Q2,2006-Q2,2006,None,2006-04-12 00:00:00
529,04/13/2006,Thursday,13,103,Week 15,,15,April,4,2006-04,Q2,2006-Q2,2006,None,2006-04-13 00:00:00
530,04/14/2006,Friday,14,104,Week 15,,15,April,4,2006-04,Q2,2006-Q2,2006,None,2006-04-14 00:00:00
531,04/15/2006,Saturday,15,105,Week 15,,15,April,4,2006-04,Q2,2006-Q2,2006,None,2006-04-15 00:00:00
532,04/16/2006,Sunday,16,106,Week 16,,16,April,4,2006-04,Q2,2006-Q2,2006,None,2006-04-16 00:00:00
533,04/17/2006,Monday,17,107,Week 16,,16,April,4,2006-04,Q2,2006-Q2,2006,None,2006-04-17 00:00:00
534,04/18/2006,Tuesday,18,108,Week 16,,16,April,4,2006-04,Q2,2006-Q2,2006,None,2006-04-18 00:00:00
535,04/19/2006,Wednesday,19,109,Week 16,,16,April,4,2006-04,Q2,2006-Q2,2006,None,2006-04-19 00:00:00
536,04/20/2006,Thursday,20,110,Week 16,,16,April,4,2006-04,Q2,2006-Q2,2006,None,2006-04-20 00:00:00
537,04/21/2006,Friday,21,111,Week 16,,16,April,4,2006-04,Q2,2006-Q2,2006,None,2006-04-21 00:00:00
538,04/22/2006,Saturday,22,112,Week 16,,16,April,4,2006-04,Q2,2006-Q2,2006,None,2006-04-22 00:00:00
539,04/23/2006,Sunday,23,113,Week 17,,17,April,4,2006-04,Q2,2006-Q2,2006,None,2006-04-23 00:00:00
540,04/24/2006,Monday,24,114,Week 17,,17,April,4,2006-04,Q2,2006-Q2,2006,None,2006-04-24 00:00:00
541,04/25/2006,Tuesday,25,115,Week 17,,17,April,4,2006-04,Q2,2006-Q2,2006,None,2006-04-25 00:00:00
542,04/26/2006,Wednesday,26,116,Week 17,,17,April,4,2006-04,Q2,2006-Q2,2006,None,2006-04-26 00:00:00
543,04/27/2006,Thursday,27,117,Week 17,,17,April,4,2006-04,Q2,2006-Q2,2006,None,2006-04-27 00:00:00
544,04/28/2006,Friday,28,118,Week 17,,17,April,4,2006-04,Q2,2006-Q2,2006,None,2006-04-28 00:00:00
545,04/29/2006,Saturday,29,119,Week 17,,17,April,4,2006-04,Q2,2006-Q2,2006,None,2006-04-29 00:00:00
546,04/30/2006,Sunday,30,120,Week 18,,18,April,4,2006-04,Q2,2006-Q2,2006,None,2006-04-30 00:00:00
547,05/01/2006,Monday,1,121,Week 18,,18,May,5,2006-05,Q2,2006-Q2,2006,None,2006-05-01 00:00:00
548,05/02/2006,Tuesday,2,122,Week 18,,18,May,5,2006-05,Q2,2006-Q2,2006,None,2006-05-02 00:00:00
549,05/03/2006,Wednesday,3,123,Week 18,,18,May,5,2006-05,Q2,2006-Q2,2006,None,2006-05-03 00:00:00
550,05/04/2006,Thursday,4,124,Week 18,,18,May,5,2006-05,Q2,2006-Q2,2006,None,2006-05-04 00:00:00
551,05/05/2006,Friday,5,125,Week 18,,18,May,5,2006-05,Q2,2006-Q2,2006,None,2006-05-05 00:00:00
552,05/06/2006,Saturday,6,126,Week 18,,18,May,5,2006-05,Q2,2006-Q2,2006,None,2006-05-06 00:00:00
553,05/07/2006,Sunday,7,127,Week 19,,19,May,5,2006-05,Q2,2006-Q2,2006,None,2006-05-07 00:00:00
554,05/08/2006,Monday,8,128,Week 19,,19,May,5,2006-05,Q2,2006-Q2,2006,None,2006-05-08 00:00:00
555,05/09/2006,Tuesday,9,129,Week 19,,19,May,5,2006-05,Q2,2006-Q2,2006,None,2006-05-09 00:00:00
556,05/10/2006,Wednesday,10,130,Week 19,,19,May,5,2006-05,Q2,2006-Q2,2006,None,2006-05-10 00:00:00
557,05/11/2006,Thursday,11,131,Week 19,,19,May,5,2006-05,Q2,2006-Q2,2006,None,2006-05-11 00:00:00
558,05/12/2006,Friday,12,132,Week 19,,19,May,5,2006-05,Q2,2006-Q2,2006,None,2006-05-12 00:00:00
559,05/13/2006,Saturday,13,133,Week 19,,19,May,5,2006-05,Q2,2006-Q2,2006,None,2006-05-13 00:00:00
560,05/14/2006,Sunday,14,134,Week 20,,20,May,5,2006-05,Q2,2006-Q2,2006,None,2006-05-14 00:00:00
561,05/15/2006,Monday,15,135,Week 20,,20,May,5,2006-05,Q2,2006-Q2,2006,None,2006-05-15 00:00:00
562,05/16/2006,Tuesday,16,136,Week 20,,20,May,5,2006-05,Q2,2006-Q2,2006,None,2006-05-16 00:00:00
563,05/17/2006,Wednesday,17,137,Week 20,,20,May,5,2006-05,Q2,2006-Q2,2006,None,2006-05-17 00:00:00
564,05/18/2006,Thursday,18,138,Week 20,,20,May,5,2006-05,Q2,2006-Q2,2006,None,2006-05-18 00:00:00
565,05/19/2006,Friday,19,139,Week 20,,20,May,5,2006-05,Q2,2006-Q2,2006,None,2006-05-19 00:00:00
566,05/20/2006,Saturday,20,140,Week 20,,20,May,5,2006-05,Q2,2006-Q2,2006,None,2006-05-20 00:00:00
567,05/21/2006,Sunday,21,141,Week 21,,21,May,5,2006-05,Q2,2006-Q2,2006,None,2006-05-21 00:00:00
568,05/22/2006,Monday,22,142,Week 21,,21,May,5,2006-05,Q2,2006-Q2,2006,None,2006-05-22 00:00:00
569,05/23/2006,Tuesday,23,143,Week 21,,21,May,5,2006-05,Q2,2006-Q2,2006,None,2006-05-23 00:00:00
570,05/24/2006,Wednesday,24,144,Week 21,,21,May,5,2006-05,Q2,2006-Q2,2006,None,2006-05-24 00:00:00
571,05/25/2006,Thursday,25,145,Week 21,,21,May,5,2006-05,Q2,2006-Q2,2006,None,2006-05-25 00:00:00
572,05/26/2006,Friday,26,146,Week 21,,21,May,5,2006-05,Q2,2006-Q2,2006,None,2006-05-26 00:00:00
573,05/27/2006,Saturday,27,147,Week 21,,21,May,5,2006-05,Q2,2006-Q2,2006,None,2006-05-27 00:00:00
574,05/28/2006,Sunday,28,148,Week 22,,22,May,5,2006-05,Q2,2006-Q2,2006,None,2006-05-28 00:00:00
575,05/29/2006,Monday,29,149,Week 22,,22,May,5,2006-05,Q2,2006-Q2,2006,None,2006-05-29 00:00:00
576,05/30/2006,Tuesday,30,150,Week 22,,22,May,5,2006-05,Q2,2006-Q2,2006,None,2006-05-30 00:00:00
577,05/31/2006,Wednesday,31,151,Week 22,,22,May,5,2006-05,Q2,2006-Q2,2006,None,2006-05-31 00:00:00
578,06/01/2006,Thursday,1,152,Week 22,,22,June,6,2006-06,Q2,2006-Q2,2006,None,2006-06-01 00:00:00
579,06/02/2006,Friday,2,153,Week 22,,22,June,6,2006-06,Q2,2006-Q2,2006,None,2006-06-02 00:00:00
580,06/03/2006,Saturday,3,154,Week 22,,22,June,6,2006-06,Q2,2006-Q2,2006,None,2006-06-03 00:00:00
581,06/04/2006,Sunday,4,155,Week 23,,23,June,6,2006-06,Q2,2006-Q2,2006,None,2006-06-04 00:00:00
582,06/05/2006,Monday,5,156,Week 23,,23,June,6,2006-06,Q2,2006-Q2,2006,None,2006-06-05 00:00:00
583,06/06/2006,Tuesday,6,157,Week 23,,23,June,6,2006-06,Q2,2006-Q2,2006,None,2006-06-06 00:00:00
584,06/07/2006,Wednesday,7,158,Week 23,,23,June,6,2006-06,Q2,2006-Q2,2006,None,2006-06-07 00:00:00
585,06/08/2006,Thursday,8,159,Week 23,,23,June,6,2006-06,Q2,2006-Q2,2006,None,2006-06-08 00:00:00
586,06/09/2006,Friday,9,160,Week 23,,23,June,6,2006-06,Q2,2006-Q2,2006,None,2006-06-09 00:00:00
587,06/10/2006,Saturday,10,161,Week 23,,23,June,6,2006-06,Q2,2006-Q2,2006,None,2006-06-10 00:00:00
588,06/11/2006,Sunday,11,162,Week 24,,24,June,6,2006-06,Q2,2006-Q2,2006,None,2006-06-11 00:00:00
589,06/12/2006,Monday,12,163,Week 24,,24,June,6,2006-06,Q2,2006-Q2,2006,None,2006-06-12 00:00:00
590,06/13/2006,Tuesday,13,164,Week 24,,24,June,6,2006-06,Q2,2006-Q2,2006,None,2006-06-13 00:00:00
591,06/14/2006,Wednesday,14,165,Week 24,,24,June,6,2006-06,Q2,2006-Q2,2006,None,2006-06-14 00:00:00
592,06/15/2006,Thursday,15,166,Week 24,,24,June,6,2006-06,Q2,2006-Q2,2006,None,2006-06-15 00:00:00
593,06/16/2006,Friday,16,167,Week 24,,24,June,6,2006-06,Q2,2006-Q2,2006,None,2006-06-16 00:00:00
594,06/17/2006,Saturday,17,168,Week 24,,24,June,6,2006-06,Q2,2006-Q2,2006,None,2006-06-17 00:00:00
595,06/18/2006,Sunday,18,169,Week 25,,25,June,6,2006-06,Q2,2006-Q2,2006,None,2006-06-18 00:00:00
596,06/19/2006,Monday,19,170,Week 25,,25,June,6,2006-06,Q2,2006-Q2,2006,None,2006-06-19 00:00:00
597,06/20/2006,Tuesday,20,171,Week 25,,25,June,6,2006-06,Q2,2006-Q2,2006,None,2006-06-20 00:00:00
598,06/21/2006,Wednesday,21,172,Week 25,,25,June,6,2006-06,Q2,2006-Q2,2006,None,2006-06-21 00:00:00
599,06/22/2006,Thursday,22,173,Week 25,,25,June,6,2006-06,Q2,2006-Q2,2006,None,2006-06-22 00:00:00
600,06/23/2006,Friday,23,174,Week 25,,25,June,6,2006-06,Q2,2006-Q2,2006,None,2006-06-23 00:00:00
601,06/24/2006,Saturday,24,175,Week 25,,25,June,6,2006-06,Q2,2006-Q2,2006,None,2006-06-24 00:00:00
602,06/25/2006,Sunday,25,176,Week 26,,26,June,6,2006-06,Q2,2006-Q2,2006,None,2006-06-25 00:00:00
603,06/26/2006,Monday,26,177,Week 26,,26,June,6,2006-06,Q2,2006-Q2,2006,None,2006-06-26 00:00:00
604,06/27/2006,Tuesday,27,178,Week 26,,26,June,6,2006-06,Q2,2006-Q2,2006,None,2006-06-27 00:00:00
605,06/28/2006,Wednesday,28,179,Week 26,,26,June,6,2006-06,Q2,2006-Q2,2006,None,2006-06-28 00:00:00
606,06/29/2006,Thursday,29,180,Week 26,,26,June,6,2006-06,Q2,2006-Q2,2006,None,2006-06-29 00:00:00
607,06/30/2006,Friday,30,181,Week 26,,26,June,6,2006-06,Q2,2006-Q2,2006,None,2006-06-30 00:00:00
608,07/01/2006,Saturday,1,182,Week 26,,26,July,7,2006-07,Q3,2006-Q3,2006,None,2006-07-01 00:00:00
609,07/02/2006,Sunday,2,183,Week 27,,27,July,7,2006-07,Q3,2006-Q3,2006,None,2006-07-02 00:00:00
610,07/03/2006,Monday,3,184,Week 27,,27,July,7,2006-07,Q3,2006-Q3,2006,None,2006-07-03 00:00:00
611,07/04/2006,Tuesday,4,185,Week 27,,27,July,7,2006-07,Q3,2006-Q3,2006,None,2006-07-04 00:00:00
612,07/05/2006,Wednesday,5,186,Week 27,,27,July,7,2006-07,Q3,2006-Q3,2006,None,2006-07-05 00:00:00
613,07/06/2006,Thursday,6,187,Week 27,,27,July,7,2006-07,Q3,2006-Q3,2006,None,2006-07-06 00:00:00
614,07/07/2006,Friday,7,188,Week 27,,27,July,7,2006-07,Q3,2006-Q3,2006,None,2006-07-07 00:00:00
615,07/08/2006,Saturday,8,189,Week 27,,27,July,7,2006-07,Q3,2006-Q3,2006,None,2006-07-08 00:00:00
616,07/09/2006,Sunday,9,190,Week 28,,28,July,7,2006-07,Q3,2006-Q3,2006,None,2006-07-09 00:00:00
617,07/10/2006,Monday,10,191,Week 28,,28,July,7,2006-07,Q3,2006-Q3,2006,None,2006-07-10 00:00:00
618,07/11/2006,Tuesday,11,192,Week 28,,28,July,7,2006-07,Q3,2006-Q3,2006,None,2006-07-11 00:00:00
619,07/12/2006,Wednesday,12,193,Week 28,,28,July,7,2006-07,Q3,2006-Q3,2006,None,2006-07-12 00:00:00
620,07/13/2006,Thursday,13,194,Week 28,,28,July,7,2006-07,Q3,2006-Q3,2006,None,2006-07-13 00:00:00
621,07/14/2006,Friday,14,195,Week 28,,28,July,7,2006-07,Q3,2006-Q3,2006,None,2006-07-14 00:00:00
622,07/15/2006,Saturday,15,196,Week 28,,28,July,7,2006-07,Q3,2006-Q3,2006,None,2006-07-15 00:00:00
623,07/16/2006,Sunday,16,197,Week 29,,29,July,7,2006-07,Q3,2006-Q3,2006,None,2006-07-16 00:00:00
624,07/17/2006,Monday,17,198,Week 29,,29,July,7,2006-07,Q3,2006-Q3,2006,None,2006-07-17 00:00:00
625,07/18/2006,Tuesday,18,199,Week 29,,29,July,7,2006-07,Q3,2006-Q3,2006,None,2006-07-18 00:00:00
626,07/19/2006,Wednesday,19,200,Week 29,,29,July,7,2006-07,Q3,2006-Q3,2006,None,2006-07-19 00:00:00
627,07/20/2006,Thursday,20,201,Week 29,,29,July,7,2006-07,Q3,2006-Q3,2006,None,2006-07-20 00:00:00
628,07/21/2006,Friday,21,202,Week 29,,29,July,7,2006-07,Q3,2006-Q3,2006,None,2006-07-21 00:00:00
629,07/22/2006,Saturday,22,203,Week 29,,29,July,7,2006-07,Q3,2006-Q3,2006,None,2006-07-22 00:00:00
630,07/23/2006,Sunday,23,204,Week 30,,30,July,7,2006-07,Q3,2006-Q3,2006,None,2006-07-23 00:00:00
631,07/24/2006,Monday,24,205,Week 30,,30,July,7,2006-07,Q3,2006-Q3,2006,None,2006-07-24 00:00:00
632,07/25/2006,Tuesday,25,206,Week 30,,30,July,7,2006-07,Q3,2006-Q3,2006,None,2006-07-25 00:00:00
633,07/26/2006,Wednesday,26,207,Week 30,,30,July,7,2006-07,Q3,2006-Q3,2006,None,2006-07-26 00:00:00
634,07/27/2006,Thursday,27,208,Week 30,,30,July,7,2006-07,Q3,2006-Q3,2006,None,2006-07-27 00:00:00
635,07/28/2006,Friday,28,209,Week 30,,30,July,7,2006-07,Q3,2006-Q3,2006,None,2006-07-28 00:00:00
636,07/29/2006,Saturday,29,210,Week 30,,30,July,7,2006-07,Q3,2006-Q3,2006,None,2006-07-29 00:00:00
637,07/30/2006,Sunday,30,211,Week 31,,31,July,7,2006-07,Q3,2006-Q3,2006,None,2006-07-30 00:00:00
638,07/31/2006,Monday,31,212,Week 31,,31,July,7,2006-07,Q3,2006-Q3,2006,None,2006-07-31 00:00:00
639,08/01/2006,Tuesday,1,213,Week 31,,31,August,8,2006-08,Q3,2006-Q3,2006,None,2006-08-01 00:00:00
640,08/02/2006,Wednesday,2,214,Week 31,,31,August,8,2006-08,Q3,2006-Q3,2006,None,2006-08-02 00:00:00
641,08/03/2006,Thursday,3,215,Week 31,,31,August,8,2006-08,Q3,2006-Q3,2006,None,2006-08-03 00:00:00
642,08/04/2006,Friday,4,216,Week 31,,31,August,8,2006-08,Q3,2006-Q3,2006,None,2006-08-04 00:00:00
643,08/05/2006,Saturday,5,217,Week 31,,31,August,8,2006-08,Q3,2006-Q3,2006,None,2006-08-05 00:00:00
644,08/06/2006,Sunday,6,218,Week 32,,32,August,8,2006-08,Q3,2006-Q3,2006,None,2006-08-06 00:00:00
645,08/07/2006,Monday,7,219,Week 32,,32,August,8,2006-08,Q3,2006-Q3,2006,None,2006-08-07 00:00:00
646,08/08/2006,Tuesday,8,220,Week 32,,32,August,8,2006-08,Q3,2006-Q3,2006,None,2006-08-08 00:00:00
647,08/09/2006,Wednesday,9,221,Week 32,,32,August,8,2006-08,Q3,2006-Q3,2006,None,2006-08-09 00:00:00
648,08/10/2006,Thursday,10,222,Week 32,,32,August,8,2006-08,Q3,2006-Q3,2006,None,2006-08-10 00:00:00
649,08/11/2006,Friday,11,223,Week 32,,32,August,8,2006-08,Q3,2006-Q3,2006,None,2006-08-11 00:00:00
650,08/12/2006,Saturday,12,224,Week 32,,32,August,8,2006-08,Q3,2006-Q3,2006,None,2006-08-12 00:00:00
651,08/13/2006,Sunday,13,225,Week 33,,33,August,8,2006-08,Q3,2006-Q3,2006,None,2006-08-13 00:00:00
652,08/14/2006,Monday,14,226,Week 33,,33,August,8,2006-08,Q3,2006-Q3,2006,None,2006-08-14 00:00:00
653,08/15/2006,Tuesday,15,227,Week 33,,33,August,8,2006-08,Q3,2006-Q3,2006,None,2006-08-15 00:00:00
654,08/16/2006,Wednesday,16,228,Week 33,,33,August,8,2006-08,Q3,2006-Q3,2006,None,2006-08-16 00:00:00
655,08/17/2006,Thursday,17,229,Week 33,,33,August,8,2006-08,Q3,2006-Q3,2006,None,2006-08-17 00:00:00
656,08/18/2006,Friday,18,230,Week 33,,33,August,8,2006-08,Q3,2006-Q3,2006,None,2006-08-18 00:00:00
657,08/19/2006,Saturday,19,231,Week 33,,33,August,8,2006-08,Q3,2006-Q3,2006,None,2006-08-19 00:00:00
658,08/20/2006,Sunday,20,232,Week 34,,34,August,8,2006-08,Q3,2006-Q3,2006,None,2006-08-20 00:00:00
659,08/21/2006,Monday,21,233,Week 34,,34,August,8,2006-08,Q3,2006-Q3,2006,None,2006-08-21 00:00:00
660,08/22/2006,Tuesday,22,234,Week 34,,34,August,8,2006-08,Q3,2006-Q3,2006,None,2006-08-22 00:00:00
661,08/23/2006,Wednesday,23,235,Week 34,,34,August,8,2006-08,Q3,2006-Q3,2006,None,2006-08-23 00:00:00
662,08/24/2006,Thursday,24,236,Week 34,,34,August,8,2006-08,Q3,2006-Q3,2006,None,2006-08-24 00:00:00
663,08/25/2006,Friday,25,237,Week 34,,34,August,8,2006-08,Q3,2006-Q3,2006,None,2006-08-25 00:00:00
664,08/26/2006,Saturday,26,238,Week 34,,34,August,8,2006-08,Q3,2006-Q3,2006,None,2006-08-26 00:00:00
665,08/27/2006,Sunday,27,239,Week 35,,35,August,8,2006-08,Q3,2006-Q3,2006,None,2006-08-27 00:00:00
666,08/28/2006,Monday,28,240,Week 35,,35,August,8,2006-08,Q3,2006-Q3,2006,None,2006-08-28 00:00:00
667,08/29/2006,Tuesday,29,241,Week 35,,35,August,8,2006-08,Q3,2006-Q3,2006,None,2006-08-29 00:00:00
668,08/30/2006,Wednesday,30,242,Week 35,,35,August,8,2006-08,Q3,2006-Q3,2006,None,2006-08-30 00:00:00
669,08/31/2006,Thursday,31,243,Week 35,,35,August,8,2006-08,Q3,2006-Q3,2006,None,2006-08-31 00:00:00
670,09/01/2006,Friday,1,244,Week 35,,35,September,9,2006-09,Q3,2006-Q3,2006,None,2006-09-01 00:00:00
671,09/02/2006,Saturday,2,245,Week 35,,35,September,9,2006-09,Q3,2006-Q3,2006,None,2006-09-02 00:00:00
672,09/03/2006,Sunday,3,246,Week 36,,36,September,9,2006-09,Q3,2006-Q3,2006,None,2006-09-03 00:00:00
673,09/04/2006,Monday,4,247,Week 36,,36,September,9,2006-09,Q3,2006-Q3,2006,None,2006-09-04 00:00:00
674,09/05/2006,Tuesday,5,248,Week 36,,36,September,9,2006-09,Q3,2006-Q3,2006,None,2006-09-05 00:00:00
675,09/06/2006,Wednesday,6,249,Week 36,,36,September,9,2006-09,Q3,2006-Q3,2006,None,2006-09-06 00:00:00
676,09/07/2006,Thursday,7,250,Week 36,,36,September,9,2006-09,Q3,2006-Q3,2006,None,2006-09-07 00:00:00
677,09/08/2006,Friday,8,251,Week 36,,36,September,9,2006-09,Q3,2006-Q3,2006,None,2006-09-08 00:00:00
678,09/09/2006,Saturday,9,252,Week 36,,36,September,9,2006-09,Q3,2006-Q3,2006,None,2006-09-09 00:00:00
679,09/10/2006,Sunday,10,253,Week 37,,37,September,9,2006-09,Q3,2006-Q3,2006,None,2006-09-10 00:00:00
680,09/11/2006,Monday,11,254,Week 37,,37,September,9,2006-09,Q3,2006-Q3,2006,None,2006-09-11 00:00:00
681,09/12/2006,Tuesday,12,255,Week 37,,37,September,9,2006-09,Q3,2006-Q3,2006,None,2006-09-12 00:00:00
682,09/13/2006,Wednesday,13,256,Week 37,,37,September,9,2006-09,Q3,2006-Q3,2006,None,2006-09-13 00:00:00
683,09/14/2006,Thursday,14,257,Week 37,,37,September,9,2006-09,Q3,2006-Q3,2006,None,2006-09-14 00:00:00
684,09/15/2006,Friday,15,258,Week 37,,37,September,9,2006-09,Q3,2006-Q3,2006,None,2006-09-15 00:00:00
685,09/16/2006,Saturday,16,259,Week 37,,37,September,9,2006-09,Q3,2006-Q3,2006,None,2006-09-16 00:00:00
686,09/17/2006,Sunday,17,260,Week 38,,38,September,9,2006-09,Q3,2006-Q3,2006,None,2006-09-17 00:00:00
687,09/18/2006,Monday,18,261,Week 38,,38,September,9,2006-09,Q3,2006-Q3,2006,None,2006-09-18 00:00:00
688,09/19/2006,Tuesday,19,262,Week 38,,38,September,9,2006-09,Q3,2006-Q3,2006,None,2006-09-19 00:00:00
689,09/20/2006,Wednesday,20,263,Week 38,,38,September,9,2006-09,Q3,2006-Q3,2006,None,2006-09-20 00:00:00
690,09/21/2006,Thursday,21,264,Week 38,,38,September,9,2006-09,Q3,2006-Q3,2006,None,2006-09-21 00:00:00
691,09/22/2006,Friday,22,265,Week 38,,38,September,9,2006-09,Q3,2006-Q3,2006,None,2006-09-22 00:00:00
692,09/23/2006,Saturday,23,266,Week 38,,38,September,9,2006-09,Q3,2006-Q3,2006,None,2006-09-23 00:00:00
693,09/24/2006,Sunday,24,267,Week 39,,39,September,9,2006-09,Q3,2006-Q3,2006,None,2006-09-24 00:00:00
694,09/25/2006,Monday,25,268,Week 39,,39,September,9,2006-09,Q3,2006-Q3,2006,None,2006-09-25 00:00:00
695,09/26/2006,Tuesday,26,269,Week 39,,39,September,9,2006-09,Q3,2006-Q3,2006,None,2006-09-26 00:00:00
696,09/27/2006,Wednesday,27,270,Week 39,,39,September,9,2006-09,Q3,2006-Q3,2006,None,2006-09-27 00:00:00
697,09/28/2006,Thursday,28,271,Week 39,,39,September,9,2006-09,Q3,2006-Q3,2006,None,2006-09-28 00:00:00
698,09/29/2006,Friday,29,272,Week 39,,39,September,9,2006-09,Q3,2006-Q3,2006,None,2006-09-29 00:00:00
699,09/30/2006,Saturday,30,273,Week 39,,39,September,9,2006-09,Q3,2006-Q3,2006,None,2006-09-30 00:00:00
700,10/01/2006,Sunday,1,274,Week 40,,40,October,10,2006-10,Q4,2006-Q4,2006,None,2006-10-01 00:00:00
701,10/02/2006,Monday,2,275,Week 40,,40,October,10,2006-10,Q4,2006-Q4,2006,None,2006-10-02 00:00:00
702,10/03/2006,Tuesday,3,276,Week 40,,40,October,10,2006-10,Q4,2006-Q4,2006,None,2006-10-03 00:00:00
703,10/04/2006,Wednesday,4,277,Week 40,,40,October,10,2006-10,Q4,2006-Q4,2006,None,2006-10-04 00:00:00
704,10/05/2006,Thursday,5,278,Week 40,,40,October,10,2006-10,Q4,2006-Q4,2006,None,2006-10-05 00:00:00
705,10/06/2006,Friday,6,279,Week 40,,40,October,10,2006-10,Q4,2006-Q4,2006,None,2006-10-06 00:00:00
706,10/07/2006,Saturday,7,280,Week 40,,40,October,10,2006-10,Q4,2006-Q4,2006,None,2006-10-07 00:00:00
707,10/08/2006,Sunday,8,281,Week 41,,41,October,10,2006-10,Q4,2006-Q4,2006,None,2006-10-08 00:00:00
708,10/09/2006,Monday,9,282,Week 41,,41,October,10,2006-10,Q4,2006-Q4,2006,None,2006-10-09 00:00:00
709,10/10/2006,Tuesday,10,283,Week 41,,41,October,10,2006-10,Q4,2006-Q4,2006,None,2006-10-10 00:00:00
710,10/11/2006,Wednesday,11,284,Week 41,,41,October,10,2006-10,Q4,2006-Q4,2006,None,2006-10-11 00:00:00
711,10/12/2006,Thursday,12,285,Week 41,,41,October,10,2006-10,Q4,2006-Q4,2006,None,2006-10-12 00:00:00
712,10/13/2006,Friday,13,286,Week 41,,41,October,10,2006-10,Q4,2006-Q4,2006,None,2006-10-13 00:00:00
713,10/14/2006,Saturday,14,287,Week 41,,41,October,10,2006-10,Q4,2006-Q4,2006,None,2006-10-14 00:00:00
714,10/15/2006,Sunday,15,288,Week 42,,42,October,10,2006-10,Q4,2006-Q4,2006,None,2006-10-15 00:00:00
715,10/16/2006,Monday,16,289,Week 42,,42,October,10,2006-10,Q4,2006-Q4,2006,None,2006-10-16 00:00:00
716,10/17/2006,Tuesday,17,290,Week 42,,42,October,10,2006-10,Q4,2006-Q4,2006,None,2006-10-17 00:00:00
717,10/18/2006,Wednesday,18,291,Week 42,,42,October,10,2006-10,Q4,2006-Q4,2006,None,2006-10-18 00:00:00
718,10/19/2006,Thursday,19,292,Week 42,,42,October,10,2006-10,Q4,2006-Q4,2006,None,2006-10-19 00:00:00
719,10/20/2006,Friday,20,293,Week 42,,42,October,10,2006-10,Q4,2006-Q4,2006,None,2006-10-20 00:00:00
720,10/21/2006,Saturday,21,294,Week 42,,42,October,10,2006-10,Q4,2006-Q4,2006,None,2006-10-21 00:00:00
721,10/22/2006,Sunday,22,295,Week 43,,43,October,10,2006-10,Q4,2006-Q4,2006,None,2006-10-22 00:00:00
722,10/23/2006,Monday,23,296,Week 43,,43,October,10,2006-10,Q4,2006-Q4,2006,None,2006-10-23 00:00:00
723,10/24/2006,Tuesday,24,297,Week 43,,43,October,10,2006-10,Q4,2006-Q4,2006,None,2006-10-24 00:00:00
724,10/25/2006,Wednesday,25,298,Week 43,,43,October,10,2006-10,Q4,2006-Q4,2006,None,2006-10-25 00:00:00
725,10/26/2006,Thursday,26,299,Week 43,,43,October,10,2006-10,Q4,2006-Q4,2006,None,2006-10-26 00:00:00
726,10/27/2006,Friday,27,300,Week 43,,43,October,10,2006-10,Q4,2006-Q4,2006,None,2006-10-27 00:00:00
727,10/28/2006,Saturday,28,301,Week 43,,43,October,10,2006-10,Q4,2006-Q4,2006,None,2006-10-28 00:00:00
728,10/29/2006,Sunday,29,302,Week 44,,44,October,10,2006-10,Q4,2006-Q4,2006,None,2006-10-29 00:00:00
729,10/30/2006,Monday,30,303,Week 44,,44,October,10,2006-10,Q4,2006-Q4,2006,None,2006-10-30 00:00:00
730,10/31/2006,Tuesday,31,304,Week 44,,44,October,10,2006-10,Q4,2006-Q4,2006,None,2006-10-31 00:00:00
731,11/01/2006,Wednesday,1,305,Week 44,,44,November,11,2006-11,Q4,2006-Q4,2006,None,2006-11-01 00:00:00
732,11/02/2006,Thursday,2,306,Week 44,,44,November,11,2006-11,Q4,2006-Q4,2006,None,2006-11-02 00:00:00
733,11/03/2006,Friday,3,307,Week 44,,44,November,11,2006-11,Q4,2006-Q4,2006,None,2006-11-03 00:00:00
734,11/04/2006,Saturday,4,308,Week 44,,44,November,11,2006-11,Q4,2006-Q4,2006,None,2006-11-04 00:00:00
735,11/05/2006,Sunday,5,309,Week 45,,45,November,11,2006-11,Q4,2006-Q4,2006,None,2006-11-05 00:00:00
736,11/06/2006,Monday,6,310,Week 45,,45,November,11,2006-11,Q4,2006-Q4,2006,None,2006-11-06 00:00:00
737,11/07/2006,Tuesday,7,311,Week 45,,45,November,11,2006-11,Q4,2006-Q4,2006,None,2006-11-07 00:00:00
738,11/08/2006,Wednesday,8,312,Week 45,,45,November,11,2006-11,Q4,2006-Q4,2006,None,2006-11-08 00:00:00
739,11/09/2006,Thursday,9,313,Week 45,,45,November,11,2006-11,Q4,2006-Q4,2006,None,2006-11-09 00:00:00
740,11/10/2006,Friday,10,314,Week 45,,45,November,11,2006-11,Q4,2006-Q4,2006,None,2006-11-10 00:00:00
741,11/11/2006,Saturday,11,315,Week 45,,45,November,11,2006-11,Q4,2006-Q4,2006,None,2006-11-11 00:00:00
742,11/12/2006,Sunday,12,316,Week 46,,46,November,11,2006-11,Q4,2006-Q4,2006,None,2006-11-12 00:00:00
743,11/13/2006,Monday,13,317,Week 46,,46,November,11,2006-11,Q4,2006-Q4,2006,None,2006-11-13 00:00:00
744,11/14/2006,Tuesday,14,318,Week 46,,46,November,11,2006-11,Q4,2006-Q4,2006,None,2006-11-14 00:00:00
745,11/15/2006,Wednesday,15,319,Week 46,,46,November,11,2006-11,Q4,2006-Q4,2006,None,2006-11-15 00:00:00
746,11/16/2006,Thursday,16,320,Week 46,,46,November,11,2006-11,Q4,2006-Q4,2006,None,2006-11-16 00:00:00
747,11/17/2006,Friday,17,321,Week 46,,46,November,11,2006-11,Q4,2006-Q4,2006,None,2006-11-17 00:00:00
748,11/18/2006,Saturday,18,322,Week 46,,46,November,11,2006-11,Q4,2006-Q4,2006,None,2006-11-18 00:00:00
749,11/19/2006,Sunday,19,323,Week 47,,47,November,11,2006-11,Q4,2006-Q4,2006,None,2006-11-19 00:00:00
750,11/20/2006,Monday,20,324,Week 47,,47,November,11,2006-11,Q4,2006-Q4,2006,None,2006-11-20 00:00:00
751,11/21/2006,Tuesday,21,325,Week 47,,47,November,11,2006-11,Q4,2006-Q4,2006,None,2006-11-21 00:00:00
752,11/22/2006,Wednesday,22,326,Week 47,,47,November,11,2006-11,Q4,2006-Q4,2006,None,2006-11-22 00:00:00
753,11/23/2006,Thursday,23,327,Week 47,,47,November,11,2006-11,Q4,2006-Q4,2006,None,2006-11-23 00:00:00
754,11/24/2006,Friday,24,328,Week 47,,47,November,11,2006-11,Q4,2006-Q4,2006,None,2006-11-24 00:00:00
755,11/25/2006,Saturday,25,329,Week 47,,47,November,11,2006-11,Q4,2006-Q4,2006,None,2006-11-25 00:00:00
756,11/26/2006,Sunday,26,330,Week 48,,48,November,11,2006-11,Q4,2006-Q4,2006,None,2006-11-26 00:00:00
757,11/27/2006,Monday,27,331,Week 48,,48,November,11,2006-11,Q4,2006-Q4,2006,None,2006-11-27 00:00:00
758,11/28/2006,Tuesday,28,332,Week 48,,48,November,11,2006-11,Q4,2006-Q4,2006,None,2006-11-28 00:00:00
759,11/29/2006,Wednesday,29,333,Week 48,,48,November,11,2006-11,Q4,2006-Q4,2006,None,2006-11-29 00:00:00
760,11/30/2006,Thursday,30,334,Week 48,,48,November,11,2006-11,Q4,2006-Q4,2006,None,2006-11-30 00:00:00
761,12/01/2006,Friday,1,335,Week 48,,48,December,12,2006-12,Q4,2006-Q4,2006,None,2006-12-01 00:00:00
762,12/02/2006,Saturday,2,336,Week 48,,48,December,12,2006-12,Q4,2006-Q4,2006,None,2006-12-02 00:00:00
763,12/03/2006,Sunday,3,337,Week 49,,49,December,12,2006-12,Q4,2006-Q4,2006,None,2006-12-03 00:00:00
764,12/04/2006,Monday,4,338,Week 49,,49,December,12,2006-12,Q4,2006-Q4,2006,None,2006-12-04 00:00:00
765,12/05/2006,Tuesday,5,339,Week 49,,49,December,12,2006-12,Q4,2006-Q4,2006,None,2006-12-05 00:00:00
766,12/06/2006,Wednesday,6,340,Week 49,,49,December,12,2006-12,Q4,2006-Q4,2006,None,2006-12-06 00:00:00
767,12/07/2006,Thursday,7,341,Week 49,,49,December,12,2006-12,Q4,2006-Q4,2006,None,2006-12-07 00:00:00
768,12/08/2006,Friday,8,342,Week 49,,49,December,12,2006-12,Q4,2006-Q4,2006,None,2006-12-08 00:00:00
769,12/09/2006,Saturday,9,343,Week 49,,49,December,12,2006-12,Q4,2006-Q4,2006,None,2006-12-09 00:00:00
770,12/10/2006,Sunday,10,344,Week 50,,50,December,12,2006-12,Q4,2006-Q4,2006,None,2006-12-10 00:00:00
771,12/11/2006,Monday,11,345,Week 50,,50,December,12,2006-12,Q4,2006-Q4,2006,None,2006-12-11 00:00:00
772,12/12/2006,Tuesday,12,346,Week 50,,50,December,12,2006-12,Q4,2006-Q4,2006,None,2006-12-12 00:00:00
773,12/13/2006,Wednesday,13,347,Week 50,,50,December,12,2006-12,Q4,2006-Q4,2006,None,2006-12-13 00:00:00
774,12/14/2006,Thursday,14,348,Week 50,,50,December,12,2006-12,Q4,2006-Q4,2006,None,2006-12-14 00:00:00
775,12/15/2006,Friday,15,349,Week 50,,50,December,12,2006-12,Q4,2006-Q4,2006,None,2006-12-15 00:00:00
776,12/16/2006,Saturday,16,350,Week 50,,50,December,12,2006-12,Q4,2006-Q4,2006,None,2006-12-16 00:00:00
777,12/17/2006,Sunday,17,351,Week 51,,51,December,12,2006-12,Q4,2006-Q4,2006,None,2006-12-17 00:00:00
778,12/18/2006,Monday,18,352,Week 51,,51,December,12,2006-12,Q4,2006-Q4,2006,None,2006-12-18 00:00:00
779,12/19/2006,Tuesday,19,353,Week 51,,51,December,12,2006-12,Q4,2006-Q4,2006,None,2006-12-19 00:00:00
780,12/20/2006,Wednesday,20,354,Week 51,,51,December,12,2006-12,Q4,2006-Q4,2006,None,2006-12-20 00:00:00
781,12/21/2006,Thursday,21,355,Week 51,,51,December,12,2006-12,Q4,2006-Q4,2006,None,2006-12-21 00:00:00
782,12/22/2006,Friday,22,356,Week 51,,51,December,12,2006-12,Q4,2006-Q4,2006,None,2006-12-22 00:00:00
783,12/23/2006,Saturday,23,357,Week 51,,51,December,12,2006-12,Q4,2006-Q4,2006,None,2006-12-23 00:00:00
784,12/24/2006,Sunday,24,358,Week 52,,52,December,12,2006-12,Q4,2006-Q4,2006,None,2006-12-24 00:00:00
785,12/25/2006,Monday,25,359,Week 52,,52,December,12,2006-12,Q4,2006-Q4,2006,None,2006-12-25 00:00:00
786,12/26/2006,Tuesday,26,360,Week 52,,52,December,12,2006-12,Q4,2006-Q4,2006,None,2006-12-26 00:00:00
787,12/27/2006,Wednesday,27,361,Week 52,,52,December,12,2006-12,Q4,2006-Q4,2006,None,2006-12-27 00:00:00
788,12/28/2006,Thursday,28,362,Week 52,,52,December,12,2006-12,Q4,2006-Q4,2006,None,2006-12-28 00:00:00
789,12/29/2006,Friday,29,363,Week 52,,52,December,12,2006-12,Q4,2006-Q4,2006,None,2006-12-29 00:00:00
790,12/30/2006,Saturday,30,364,Week 52,,52,December,12,2006-12,Q4,2006-Q4,2006,None,2006-12-30 00:00:00
791,12/31/2006,Sunday,31,365,Week 52,,52,December,12,2006-12,Q4,2006-Q4,2006,None,2006-12-31 00:00:00
792,01/01/2007,Monday,1,1,Week 1,,1,January,1,2007-01,Q1,2007-Q1,2007,None,2007-01-01 00:00:00
793,01/02/2007,Tuesday,2,2,Week 1,,1,January,1,2007-01,Q1,2007-Q1,2007,None,2007-01-02 00:00:00
794,01/03/2007,Wednesday,3,3,Week 1,,1,January,1,2007-01,Q1,2007-Q1,2007,None,2007-01-03 00:00:00
795,01/04/2007,Thursday,4,4,Week 1,,1,January,1,2007-01,Q1,2007-Q1,2007,None,2007-01-04 00:00:00
796,01/05/2007,Friday,5,5,Week 1,,1,January,1,2007-01,Q1,2007-Q1,2007,None,2007-01-05 00:00:00
797,01/06/2007,Saturday,6,6,Week 1,,1,January,1,2007-01,Q1,2007-Q1,2007,None,2007-01-06 00:00:00
798,01/07/2007,Sunday,7,7,Week 1,,1,January,1,2007-01,Q1,2007-Q1,2007,None,2007-01-07 00:00:00
799,01/08/2007,Monday,8,8,Week 2,,2,January,1,2007-01,Q1,2007-Q1,2007,None,2007-01-08 00:00:00
800,01/09/2007,Tuesday,9,9,Week 2,,2,January,1,2007-01,Q1,2007-Q1,2007,None,2007-01-09 00:00:00
801,01/10/2007,Wednesday,10,10,Week 2,,2,January,1,2007-01,Q1,2007-Q1,2007,None,2007-01-10 00:00:00
802,01/11/2007,Thursday,11,11,Week 2,,2,January,1,2007-01,Q1,2007-Q1,2007,None,2007-01-11 00:00:00
803,01/12/2007,Friday,12,12,Week 2,,2,January,1,2007-01,Q1,2007-Q1,2007,None,2007-01-12 00:00:00
804,01/13/2007,Saturday,13,13,Week 2,,2,January,1,2007-01,Q1,2007-Q1,2007,None,2007-01-13 00:00:00
805,01/14/2007,Sunday,14,14,Week 2,,2,January,1,2007-01,Q1,2007-Q1,2007,None,2007-01-14 00:00:00
806,01/15/2007,Monday,15,15,Week 3,,3,January,1,2007-01,Q1,2007-Q1,2007,None,2007-01-15 00:00:00
807,01/16/2007,Tuesday,16,16,Week 3,,3,January,1,2007-01,Q1,2007-Q1,2007,None,2007-01-16 00:00:00
808,01/17/2007,Wednesday,17,17,Week 3,,3,January,1,2007-01,Q1,2007-Q1,2007,None,2007-01-17 00:00:00
809,01/18/2007,Thursday,18,18,Week 3,,3,January,1,2007-01,Q1,2007-Q1,2007,None,2007-01-18 00:00:00
810,01/19/2007,Friday,19,19,Week 3,,3,January,1,2007-01,Q1,2007-Q1,2007,None,2007-01-19 00:00:00
811,01/20/2007,Saturday,20,20,Week 3,,3,January,1,2007-01,Q1,2007-Q1,2007,None,2007-01-20 00:00:00
812,01/21/2007,Sunday,21,21,Week 3,,3,January,1,2007-01,Q1,2007-Q1,2007,None,2007-01-21 00:00:00
813,01/22/2007,Monday,22,22,Week 4,,4,January,1,2007-01,Q1,2007-Q1,2007,None,2007-01-22 00:00:00
814,01/23/2007,Tuesday,23,23,Week 4,,4,January,1,2007-01,Q1,2007-Q1,2007,None,2007-01-23 00:00:00
815,01/24/2007,Wednesday,24,24,Week 4,,4,January,1,2007-01,Q1,2007-Q1,2007,None,2007-01-24 00:00:00
816,01/25/2007,Thursday,25,25,Week 4,,4,January,1,2007-01,Q1,2007-Q1,2007,None,2007-01-25 00:00:00
817,01/26/2007,Friday,26,26,Week 4,,4,January,1,2007-01,Q1,2007-Q1,2007,None,2007-01-26 00:00:00
818,01/27/2007,Saturday,27,27,Week 4,,4,January,1,2007-01,Q1,2007-Q1,2007,None,2007-01-27 00:00:00
819,01/28/2007,Sunday,28,28,Week 4,,4,January,1,2007-01,Q1,2007-Q1,2007,None,2007-01-28 00:00:00
820,01/29/2007,Monday,29,29,Week 5,,5,January,1,2007-01,Q1,2007-Q1,2007,None,2007-01-29 00:00:00
821,01/30/2007,Tuesday,30,30,Week 5,,5,January,1,2007-01,Q1,2007-Q1,2007,None,2007-01-30 00:00:00
822,01/31/2007,Wednesday,31,31,Week 5,,5,January,1,2007-01,Q1,2007-Q1,2007,None,2007-01-31 00:00:00
823,02/01/2007,Thursday,1,32,Week 5,,5,February,2,2007-02,Q1,2007-Q1,2007,None,2007-02-01 00:00:00
824,02/02/2007,Friday,2,33,Week 5,,5,February,2,2007-02,Q1,2007-Q1,2007,None,2007-02-02 00:00:00
825,02/03/2007,Saturday,3,34,Week 5,,5,February,2,2007-02,Q1,2007-Q1,2007,None,2007-02-03 00:00:00
826,02/04/2007,Sunday,4,35,Week 5,,5,February,2,2007-02,Q1,2007-Q1,2007,None,2007-02-04 00:00:00
827,02/05/2007,Monday,5,36,Week 6,,6,February,2,2007-02,Q1,2007-Q1,2007,None,2007-02-05 00:00:00
828,02/06/2007,Tuesday,6,37,Week 6,,6,February,2,2007-02,Q1,2007-Q1,2007,None,2007-02-06 00:00:00
829,02/07/2007,Wednesday,7,38,Week 6,,6,February,2,2007-02,Q1,2007-Q1,2007,None,2007-02-07 00:00:00
830,02/08/2007,Thursday,8,39,Week 6,,6,February,2,2007-02,Q1,2007-Q1,2007,None,2007-02-08 00:00:00
831,02/09/2007,Friday,9,40,Week 6,,6,February,2,2007-02,Q1,2007-Q1,2007,None,2007-02-09 00:00:00
832,02/10/2007,Saturday,10,41,Week 6,,6,February,2,2007-02,Q1,2007-Q1,2007,None,2007-02-10 00:00:00
833,02/11/2007,Sunday,11,42,Week 6,,6,February,2,2007-02,Q1,2007-Q1,2007,None,2007-02-11 00:00:00
834,02/12/2007,Monday,12,43,Week 7,,7,February,2,2007-02,Q1,2007-Q1,2007,None,2007-02-12 00:00:00
835,02/13/2007,Tuesday,13,44,Week 7,,7,February,2,2007-02,Q1,2007-Q1,2007,None,2007-02-13 00:00:00
836,02/14/2007,Wednesday,14,45,Week 7,,7,February,2,2007-02,Q1,2007-Q1,2007,None,2007-02-14 00:00:00
837,02/15/2007,Thursday,15,46,Week 7,,7,February,2,2007-02,Q1,2007-Q1,2007,None,2007-02-15 00:00:00
838,02/16/2007,Friday,16,47,Week 7,,7,February,2,2007-02,Q1,2007-Q1,2007,None,2007-02-16 00:00:00
839,02/17/2007,Saturday,17,48,Week 7,,7,February,2,2007-02,Q1,2007-Q1,2007,None,2007-02-17 00:00:00
840,02/18/2007,Sunday,18,49,Week 7,,7,February,2,2007-02,Q1,2007-Q1,2007,None,2007-02-18 00:00:00
841,02/19/2007,Monday,19,50,Week 8,,8,February,2,2007-02,Q1,2007-Q1,2007,None,2007-02-19 00:00:00
842,02/20/2007,Tuesday,20,51,Week 8,,8,February,2,2007-02,Q1,2007-Q1,2007,None,2007-02-20 00:00:00
843,02/21/2007,Wednesday,21,52,Week 8,,8,February,2,2007-02,Q1,2007-Q1,2007,None,2007-02-21 00:00:00
844,02/22/2007,Thursday,22,53,Week 8,,8,February,2,2007-02,Q1,2007-Q1,2007,None,2007-02-22 00:00:00
845,02/23/2007,Friday,23,54,Week 8,,8,February,2,2007-02,Q1,2007-Q1,2007,None,2007-02-23 00:00:00
846,02/24/2007,Saturday,24,55,Week 8,,8,February,2,2007-02,Q1,2007-Q1,2007,None,2007-02-24 00:00:00
847,02/25/2007,Sunday,25,56,Week 8,,8,February,2,2007-02,Q1,2007-Q1,2007,None,2007-02-25 00:00:00
848,02/26/2007,Monday,26,57,Week 9,,9,February,2,2007-02,Q1,2007-Q1,2007,None,2007-02-26 00:00:00
849,02/27/2007,Tuesday,27,58,Week 9,,9,February,2,2007-02,Q1,2007-Q1,2007,None,2007-02-27 00:00:00
850,02/28/2007,Wednesday,28,59,Week 9,,9,February,2,2007-02,Q1,2007-Q1,2007,None,2007-02-28 00:00:00
851,03/01/2007,Thursday,1,60,Week 9,,9,March,3,2007-03,Q1,2007-Q1,2007,None,2007-03-01 00:00:00
852,03/02/2007,Friday,2,61,Week 9,,9,March,3,2007-03,Q1,2007-Q1,2007,None,2007-03-02 00:00:00
853,03/03/2007,Saturday,3,62,Week 9,,9,March,3,2007-03,Q1,2007-Q1,2007,None,2007-03-03 00:00:00
854,03/04/2007,Sunday,4,63,Week 9,,9,March,3,2007-03,Q1,2007-Q1,2007,None,2007-03-04 00:00:00
855,03/05/2007,Monday,5,64,Week 10,,10,March,3,2007-03,Q1,2007-Q1,2007,None,2007-03-05 00:00:00
856,03/06/2007,Tuesday,6,65,Week 10,,10,March,3,2007-03,Q1,2007-Q1,2007,None,2007-03-06 00:00:00
857,03/07/2007,Wednesday,7,66,Week 10,,10,March,3,2007-03,Q1,2007-Q1,2007,None,2007-03-07 00:00:00
858,03/08/2007,Thursday,8,67,Week 10,,10,March,3,2007-03,Q1,2007-Q1,2007,None,2007-03-08 00:00:00
859,03/09/2007,Friday,9,68,Week 10,,10,March,3,2007-03,Q1,2007-Q1,2007,None,2007-03-09 00:00:00
860,03/10/2007,Saturday,10,69,Week 10,,10,March,3,2007-03,Q1,2007-Q1,2007,None,2007-03-10 00:00:00
861,03/11/2007,Sunday,11,70,Week 10,,10,March,3,2007-03,Q1,2007-Q1,2007,None,2007-03-11 00:00:00
862,03/12/2007,Monday,12,71,Week 11,,11,March,3,2007-03,Q1,2007-Q1,2007,None,2007-03-12 00:00:00
863,03/13/2007,Tuesday,13,72,Week 11,,11,March,3,2007-03,Q1,2007-Q1,2007,None,2007-03-13 00:00:00
864,03/14/2007,Wednesday,14,73,Week 11,,11,March,3,2007-03,Q1,2007-Q1,2007,None,2007-03-14 00:00:00
865,03/15/2007,Thursday,15,74,Week 11,,11,March,3,2007-03,Q1,2007-Q1,2007,None,2007-03-15 00:00:00
866,03/16/2007,Friday,16,75,Week 11,,11,March,3,2007-03,Q1,2007-Q1,2007,None,2007-03-16 00:00:00
867,03/17/2007,Saturday,17,76,Week 11,,11,March,3,2007-03,Q1,2007-Q1,2007,None,2007-03-17 00:00:00
868,03/18/2007,Sunday,18,77,Week 11,,11,March,3,2007-03,Q1,2007-Q1,2007,None,2007-03-18 00:00:00
869,03/19/2007,Monday,19,78,Week 12,,12,March,3,2007-03,Q1,2007-Q1,2007,None,2007-03-19 00:00:00
870,03/20/2007,Tuesday,20,79,Week 12,,12,March,3,2007-03,Q1,2007-Q1,2007,None,2007-03-20 00:00:00
871,03/21/2007,Wednesday,21,80,Week 12,,12,March,3,2007-03,Q1,2007-Q1,2007,None,2007-03-21 00:00:00
872,03/22/2007,Thursday,22,81,Week 12,,12,March,3,2007-03,Q1,2007-Q1,2007,None,2007-03-22 00:00:00
873,03/23/2007,Friday,23,82,Week 12,,12,March,3,2007-03,Q1,2007-Q1,2007,None,2007-03-23 00:00:00
874,03/24/2007,Saturday,24,83,Week 12,,12,March,3,2007-03,Q1,2007-Q1,2007,None,2007-03-24 00:00:00
875,03/25/2007,Sunday,25,84,Week 12,,12,March,3,2007-03,Q1,2007-Q1,2007,None,2007-03-25 00:00:00
876,03/26/2007,Monday,26,85,Week 13,,13,March,3,2007-03,Q1,2007-Q1,2007,None,2007-03-26 00:00:00
877,03/27/2007,Tuesday,27,86,Week 13,,13,March,3,2007-03,Q1,2007-Q1,2007,None,2007-03-27 00:00:00
878,03/28/2007,Wednesday,28,87,Week 13,,13,March,3,2007-03,Q1,2007-Q1,2007,None,2007-03-28 00:00:00
879,03/29/2007,Thursday,29,88,Week 13,,13,March,3,2007-03,Q1,2007-Q1,2007,None,2007-03-29 00:00:00
880,03/30/2007,Friday,30,89,Week 13,,13,March,3,2007-03,Q1,2007-Q1,2007,None,2007-03-30 00:00:00
881,03/31/2007,Saturday,31,90,Week 13,,13,March,3,2007-03,Q1,2007-Q1,2007,None,2007-03-31 00:00:00
882,04/01/2007,Sunday,1,91,Week 13,,13,April,4,2007-04,Q2,2007-Q2,2007,None,2007-04-01 00:00:00
883,04/02/2007,Monday,2,92,Week 14,,14,April,4,2007-04,Q2,2007-Q2,2007,None,2007-04-02 00:00:00
884,04/03/2007,Tuesday,3,93,Week 14,,14,April,4,2007-04,Q2,2007-Q2,2007,None,2007-04-03 00:00:00
885,04/04/2007,Wednesday,4,94,Week 14,,14,April,4,2007-04,Q2,2007-Q2,2007,None,2007-04-04 00:00:00
886,04/05/2007,Thursday,5,95,Week 14,,14,April,4,2007-04,Q2,2007-Q2,2007,None,2007-04-05 00:00:00
887,04/06/2007,Friday,6,96,Week 14,,14,April,4,2007-04,Q2,2007-Q2,2007,None,2007-04-06 00:00:00
888,04/07/2007,Saturday,7,97,Week 14,,14,April,4,2007-04,Q2,2007-Q2,2007,None,2007-04-07 00:00:00
889,04/08/2007,Sunday,8,98,Week 14,,14,April,4,2007-04,Q2,2007-Q2,2007,None,2007-04-08 00:00:00
890,04/09/2007,Monday,9,99,Week 15,,15,April,4,2007-04,Q2,2007-Q2,2007,None,2007-04-09 00:00:00
891,04/10/2007,Tuesday,10,100,Week 15,,15,April,4,2007-04,Q2,2007-Q2,2007,None,2007-04-10 00:00:00
892,04/11/2007,Wednesday,11,101,Week 15,,15,April,4,2007-04,Q2,2007-Q2,2007,None,2007-04-11 00:00:00
893,04/12/2007,Thursday,12,102,Week 15,,15,April,4,2007-04,Q2,2007-Q2,2007,None,2007-04-12 00:00:00
894,04/13/2007,Friday,13,103,Week 15,,15,April,4,2007-04,Q2,2007-Q2,2007,None,2007-04-13 00:00:00
895,04/14/2007,Saturday,14,104,Week 15,,15,April,4,2007-04,Q2,2007-Q2,2007,None,2007-04-14 00:00:00
896,04/15/2007,Sunday,15,105,Week 15,,15,April,4,2007-04,Q2,2007-Q2,2007,None,2007-04-15 00:00:00
897,04/16/2007,Monday,16,106,Week 16,,16,April,4,2007-04,Q2,2007-Q2,2007,None,2007-04-16 00:00:00
898,04/17/2007,Tuesday,17,107,Week 16,,16,April,4,2007-04,Q2,2007-Q2,2007,None,2007-04-17 00:00:00
899,04/18/2007,Wednesday,18,108,Week 16,,16,April,4,2007-04,Q2,2007-Q2,2007,None,2007-04-18 00:00:00
900,04/19/2007,Thursday,19,109,Week 16,,16,April,4,2007-04,Q2,2007-Q2,2007,None,2007-04-19 00:00:00
901,04/20/2007,Friday,20,110,Week 16,,16,April,4,2007-04,Q2,2007-Q2,2007,None,2007-04-20 00:00:00
902,04/21/2007,Saturday,21,111,Week 16,,16,April,4,2007-04,Q2,2007-Q2,2007,None,2007-04-21 00:00:00
903,04/22/2007,Sunday,22,112,Week 16,,16,April,4,2007-04,Q2,2007-Q2,2007,None,2007-04-22 00:00:00
904,04/23/2007,Monday,23,113,Week 17,,17,April,4,2007-04,Q2,2007-Q2,2007,None,2007-04-23 00:00:00
905,04/24/2007,Tuesday,24,114,Week 17,,17,April,4,2007-04,Q2,2007-Q2,2007,None,2007-04-24 00:00:00
906,04/25/2007,Wednesday,25,115,Week 17,,17,April,4,2007-04,Q2,2007-Q2,2007,None,2007-04-25 00:00:00
907,04/26/2007,Thursday,26,116,Week 17,,17,April,4,2007-04,Q2,2007-Q2,2007,None,2007-04-26 00:00:00
908,04/27/2007,Friday,27,117,Week 17,,17,April,4,2007-04,Q2,2007-Q2,2007,None,2007-04-27 00:00:00
909,04/28/2007,Saturday,28,118,Week 17,,17,April,4,2007-04,Q2,2007-Q2,2007,None,2007-04-28 00:00:00
910,04/29/2007,Sunday,29,119,Week 17,,17,April,4,2007-04,Q2,2007-Q2,2007,None,2007-04-29 00:00:00
911,04/30/2007,Monday,30,120,Week 18,,18,April,4,2007-04,Q2,2007-Q2,2007,None,2007-04-30 00:00:00
912,05/01/2007,Tuesday,1,121,Week 18,,18,May,5,2007-05,Q2,2007-Q2,2007,None,2007-05-01 00:00:00
913,05/02/2007,Wednesday,2,122,Week 18,,18,May,5,2007-05,Q2,2007-Q2,2007,None,2007-05-02 00:00:00
914,05/03/2007,Thursday,3,123,Week 18,,18,May,5,2007-05,Q2,2007-Q2,2007,None,2007-05-03 00:00:00
915,05/04/2007,Friday,4,124,Week 18,,18,May,5,2007-05,Q2,2007-Q2,2007,None,2007-05-04 00:00:00
916,05/05/2007,Saturday,5,125,Week 18,,18,May,5,2007-05,Q2,2007-Q2,2007,None,2007-05-05 00:00:00
917,05/06/2007,Sunday,6,126,Week 18,,18,May,5,2007-05,Q2,2007-Q2,2007,None,2007-05-06 00:00:00
918,05/07/2007,Monday,7,127,Week 19,,19,May,5,2007-05,Q2,2007-Q2,2007,None,2007-05-07 00:00:00
919,05/08/2007,Tuesday,8,128,Week 19,,19,May,5,2007-05,Q2,2007-Q2,2007,None,2007-05-08 00:00:00
920,05/09/2007,Wednesday,9,129,Week 19,,19,May,5,2007-05,Q2,2007-Q2,2007,None,2007-05-09 00:00:00
921,05/10/2007,Thursday,10,130,Week 19,,19,May,5,2007-05,Q2,2007-Q2,2007,None,2007-05-10 00:00:00
922,05/11/2007,Friday,11,131,Week 19,,19,May,5,2007-05,Q2,2007-Q2,2007,None,2007-05-11 00:00:00
923,05/12/2007,Saturday,12,132,Week 19,,19,May,5,2007-05,Q2,2007-Q2,2007,None,2007-05-12 00:00:00
924,05/13/2007,Sunday,13,133,Week 19,,19,May,5,2007-05,Q2,2007-Q2,2007,None,2007-05-13 00:00:00
925,05/14/2007,Monday,14,134,Week 20,,20,May,5,2007-05,Q2,2007-Q2,2007,None,2007-05-14 00:00:00
926,05/15/2007,Tuesday,15,135,Week 20,,20,May,5,2007-05,Q2,2007-Q2,2007,None,2007-05-15 00:00:00
927,05/16/2007,Wednesday,16,136,Week 20,,20,May,5,2007-05,Q2,2007-Q2,2007,None,2007-05-16 00:00:00
928,05/17/2007,Thursday,17,137,Week 20,,20,May,5,2007-05,Q2,2007-Q2,2007,None,2007-05-17 00:00:00
929,05/18/2007,Friday,18,138,Week 20,,20,May,5,2007-05,Q2,2007-Q2,2007,None,2007-05-18 00:00:00
930,05/19/2007,Saturday,19,139,Week 20,,20,May,5,2007-05,Q2,2007-Q2,2007,None,2007-05-19 00:00:00
931,05/20/2007,Sunday,20,140,Week 20,,20,May,5,2007-05,Q2,2007-Q2,2007,None,2007-05-20 00:00:00
932,05/21/2007,Monday,21,141,Week 21,,21,May,5,2007-05,Q2,2007-Q2,2007,None,2007-05-21 00:00:00
933,05/22/2007,Tuesday,22,142,Week 21,,21,May,5,2007-05,Q2,2007-Q2,2007,None,2007-05-22 00:00:00
934,05/23/2007,Wednesday,23,143,Week 21,,21,May,5,2007-05,Q2,2007-Q2,2007,None,2007-05-23 00:00:00
935,05/24/2007,Thursday,24,144,Week 21,,21,May,5,2007-05,Q2,2007-Q2,2007,None,2007-05-24 00:00:00
936,05/25/2007,Friday,25,145,Week 21,,21,May,5,2007-05,Q2,2007-Q2,2007,None,2007-05-25 00:00:00
937,05/26/2007,Saturday,26,146,Week 21,,21,May,5,2007-05,Q2,2007-Q2,2007,None,2007-05-26 00:00:00
938,05/27/2007,Sunday,27,147,Week 21,,21,May,5,2007-05,Q2,2007-Q2,2007,None,2007-05-27 00:00:00
939,05/28/2007,Monday,28,148,Week 22,,22,May,5,2007-05,Q2,2007-Q2,2007,None,2007-05-28 00:00:00
940,05/29/2007,Tuesday,29,149,Week 22,,22,May,5,2007-05,Q2,2007-Q2,2007,None,2007-05-29 00:00:00
941,05/30/2007,Wednesday,30,150,Week 22,,22,May,5,2007-05,Q2,2007-Q2,2007,None,2007-05-30 00:00:00
942,05/31/2007,Thursday,31,151,Week 22,,22,May,5,2007-05,Q2,2007-Q2,2007,None,2007-05-31 00:00:00
943,06/01/2007,Friday,1,152,Week 22,,22,June,6,2007-06,Q2,2007-Q2,2007,None,2007-06-01 00:00:00
944,06/02/2007,Saturday,2,153,Week 22,,22,June,6,2007-06,Q2,2007-Q2,2007,None,2007-06-02 00:00:00
945,06/03/2007,Sunday,3,154,Week 22,,22,June,6,2007-06,Q2,2007-Q2,2007,None,2007-06-03 00:00:00
946,06/04/2007,Monday,4,155,Week 23,,23,June,6,2007-06,Q2,2007-Q2,2007,None,2007-06-04 00:00:00
947,06/05/2007,Tuesday,5,156,Week 23,,23,June,6,2007-06,Q2,2007-Q2,2007,None,2007-06-05 00:00:00
948,06/06/2007,Wednesday,6,157,Week 23,,23,June,6,2007-06,Q2,2007-Q2,2007,None,2007-06-06 00:00:00
949,06/07/2007,Thursday,7,158,Week 23,,23,June,6,2007-06,Q2,2007-Q2,2007,None,2007-06-07 00:00:00
950,06/08/2007,Friday,8,159,Week 23,,23,June,6,2007-06,Q2,2007-Q2,2007,None,2007-06-08 00:00:00
951,06/09/2007,Saturday,9,160,Week 23,,23,June,6,2007-06,Q2,2007-Q2,2007,None,2007-06-09 00:00:00
952,06/10/2007,Sunday,10,161,Week 23,,23,June,6,2007-06,Q2,2007-Q2,2007,None,2007-06-10 00:00:00
953,06/11/2007,Monday,11,162,Week 24,,24,June,6,2007-06,Q2,2007-Q2,2007,None,2007-06-11 00:00:00
954,06/12/2007,Tuesday,12,163,Week 24,,24,June,6,2007-06,Q2,2007-Q2,2007,None,2007-06-12 00:00:00
955,06/13/2007,Wednesday,13,164,Week 24,,24,June,6,2007-06,Q2,2007-Q2,2007,None,2007-06-13 00:00:00
956,06/14/2007,Thursday,14,165,Week 24,,24,June,6,2007-06,Q2,2007-Q2,2007,None,2007-06-14 00:00:00
957,06/15/2007,Friday,15,166,Week 24,,24,June,6,2007-06,Q2,2007-Q2,2007,None,2007-06-15 00:00:00
958,06/16/2007,Saturday,16,167,Week 24,,24,June,6,2007-06,Q2,2007-Q2,2007,None,2007-06-16 00:00:00
959,06/17/2007,Sunday,17,168,Week 24,,24,June,6,2007-06,Q2,2007-Q2,2007,None,2007-06-17 00:00:00
960,06/18/2007,Monday,18,169,Week 25,,25,June,6,2007-06,Q2,2007-Q2,2007,None,2007-06-18 00:00:00
961,06/19/2007,Tuesday,19,170,Week 25,,25,June,6,2007-06,Q2,2007-Q2,2007,None,2007-06-19 00:00:00
962,06/20/2007,Wednesday,20,171,Week 25,,25,June,6,2007-06,Q2,2007-Q2,2007,None,2007-06-20 00:00:00
963,06/21/2007,Thursday,21,172,Week 25,,25,June,6,2007-06,Q2,2007-Q2,2007,None,2007-06-21 00:00:00
964,06/22/2007,Friday,22,173,Week 25,,25,June,6,2007-06,Q2,2007-Q2,2007,None,2007-06-22 00:00:00
965,06/23/2007,Saturday,23,174,Week 25,,25,June,6,2007-06,Q2,2007-Q2,2007,None,2007-06-23 00:00:00
966,06/24/2007,Sunday,24,175,Week 25,,25,June,6,2007-06,Q2,2007-Q2,2007,None,2007-06-24 00:00:00
967,06/25/2007,Monday,25,176,Week 26,,26,June,6,2007-06,Q2,2007-Q2,2007,None,2007-06-25 00:00:00
968,06/26/2007,Tuesday,26,177,Week 26,,26,June,6,2007-06,Q2,2007-Q2,2007,None,2007-06-26 00:00:00
969,06/27/2007,Wednesday,27,178,Week 26,,26,June,6,2007-06,Q2,2007-Q2,2007,None,2007-06-27 00:00:00
970,06/28/2007,Thursday,28,179,Week 26,,26,June,6,2007-06,Q2,2007-Q2,2007,None,2007-06-28 00:00:00
971,06/29/2007,Friday,29,180,Week 26,,26,June,6,2007-06,Q2,2007-Q2,2007,None,2007-06-29 00:00:00
972,06/30/2007,Saturday,30,181,Week 26,,26,June,6,2007-06,Q2,2007-Q2,2007,None,2007-06-30 00:00:00
973,07/01/2007,Sunday,1,182,Week 26,,26,July,7,2007-07,Q3,2007-Q3,2007,None,2007-07-01 00:00:00
974,07/02/2007,Monday,2,183,Week 27,,27,July,7,2007-07,Q3,2007-Q3,2007,None,2007-07-02 00:00:00
975,07/03/2007,Tuesday,3,184,Week 27,,27,July,7,2007-07,Q3,2007-Q3,2007,None,2007-07-03 00:00:00
976,07/04/2007,Wednesday,4,185,Week 27,,27,July,7,2007-07,Q3,2007-Q3,2007,None,2007-07-04 00:00:00
977,07/05/2007,Thursday,5,186,Week 27,,27,July,7,2007-07,Q3,2007-Q3,2007,None,2007-07-05 00:00:00
978,07/06/2007,Friday,6,187,Week 27,,27,July,7,2007-07,Q3,2007-Q3,2007,None,2007-07-06 00:00:00
979,07/07/2007,Saturday,7,188,Week 27,,27,July,7,2007-07,Q3,2007-Q3,2007,None,2007-07-07 00:00:00
980,07/08/2007,Sunday,8,189,Week 27,,27,July,7,2007-07,Q3,2007-Q3,2007,None,2007-07-08 00:00:00
981,07/09/2007,Monday,9,190,Week 28,,28,July,7,2007-07,Q3,2007-Q3,2007,None,2007-07-09 00:00:00
982,07/10/2007,Tuesday,10,191,Week 28,,28,July,7,2007-07,Q3,2007-Q3,2007,None,2007-07-10 00:00:00
983,07/11/2007,Wednesday,11,192,Week 28,,28,July,7,2007-07,Q3,2007-Q3,2007,None,2007-07-11 00:00:00
984,07/12/2007,Thursday,12,193,Week 28,,28,July,7,2007-07,Q3,2007-Q3,2007,None,2007-07-12 00:00:00
985,07/13/2007,Friday,13,194,Week 28,,28,July,7,2007-07,Q3,2007-Q3,2007,None,2007-07-13 00:00:00
986,07/14/2007,Saturday,14,195,Week 28,,28,July,7,2007-07,Q3,2007-Q3,2007,None,2007-07-14 00:00:00
987,07/15/2007,Sunday,15,196,Week 28,,28,July,7,2007-07,Q3,2007-Q3,2007,None,2007-07-15 00:00:00
988,07/16/2007,Monday,16,197,Week 29,,29,July,7,2007-07,Q3,2007-Q3,2007,None,2007-07-16 00:00:00
989,07/17/2007,Tuesday,17,198,Week 29,,29,July,7,2007-07,Q3,2007-Q3,2007,None,2007-07-17 00:00:00
990,07/18/2007,Wednesday,18,199,Week 29,,29,July,7,2007-07,Q3,2007-Q3,2007,None,2007-07-18 00:00:00
991,07/19/2007,Thursday,19,200,Week 29,,29,July,7,2007-07,Q3,2007-Q3,2007,None,2007-07-19 00:00:00
992,07/20/2007,Friday,20,201,Week 29,,29,July,7,2007-07,Q3,2007-Q3,2007,None,2007-07-20 00:00:00
993,07/21/2007,Saturday,21,202,Week 29,,29,July,7,2007-07,Q3,2007-Q3,2007,None,2007-07-21 00:00:00
994,07/22/2007,Sunday,22,203,Week 29,,29,July,7,2007-07,Q3,2007-Q3,2007,None,2007-07-22 00:00:00
995,07/23/2007,Monday,23,204,Week 30,,30,July,7,2007-07,Q3,2007-Q3,2007,None,2007-07-23 00:00:00
996,07/24/2007,Tuesday,24,205,Week 30,,30,July,7,2007-07,Q3,2007-Q3,2007,None,2007-07-24 00:00:00
997,07/25/2007,Wednesday,25,206,Week 30,,30,July,7,2007-07,Q3,2007-Q3,2007,None,2007-07-25 00:00:00
998,07/26/2007,Thursday,26,207,Week 30,,30,July,7,2007-07,Q3,2007-Q3,2007,None,2007-07-26 00:00:00
999,07/27/2007,Friday,27,208,Week 30,,30,July,7,2007-07,Q3,2007-Q3,2007,None,2007-07-27 00:00:00
1000,07/28/2007,Saturday,28,209,Week 30,,30,July,7,2007-07,Q3,2007-Q3,2007,None,2007-07-28 00:00:00
1001,07/29/2007,Sunday,29,210,Week 30,,30,July,7,2007-07,Q3,2007-Q3,2007,None,2007-07-29 00:00:00
1002,07/30/2007,Monday,30,211,Week 31,,31,July,7,2007-07,Q3,2007-Q3,2007,None,2007-07-30 00:00:00
1003,07/31/2007,Tuesday,31,212,Week 31,,31,July,7,2007-07,Q3,2007-Q3,2007,None,2007-07-31 00:00:00
1004,08/01/2007,Wednesday,1,213,Week 31,,31,August,8,2007-08,Q3,2007-Q3,2007,None,2007-08-01 00:00:00
1005,08/02/2007,Thursday,2,214,Week 31,,31,August,8,2007-08,Q3,2007-Q3,2007,None,2007-08-02 00:00:00
1006,08/03/2007,Friday,3,215,Week 31,,31,August,8,2007-08,Q3,2007-Q3,2007,None,2007-08-03 00:00:00
